ISSUE;SUMMARY;ISSUE_TYPE;STATUS;ASSIGNEE;COMPONENT;TEAM;PRIORITY;CREATOR;CREATED;VISTAMODULE;FIXVERSION;ESTIMATEDAYS;CHANGES;STATUS_CHANGES;DURATION_CREATED;DURATION_BACKLOG;DURATION_INPROGRESS;DURATION_PAUSED;DURATION_INCLARIFICATION;DURATION_INCODEREVIEW;DURATION_TESTABLE;DURATION_TESTOK;DURATION_DELIVERED ;;;;;;;;;;;;;;;;;;;;;;;;;;;;;;;;;;;;;;;;;;;;;;;;;;;;;;;;;;;;;;;;;;;;;;;;;;;;;;;;;;;;;;;;;;;;;;;;;;;;;;;;
HV-12311;RENT: Deletion of Ordered Equipment Type not possible;Bug;Backlog;null;Multilog Rental;null;Medium;Rainer Kohnert;05.12.2022 14:40;RENT;;;5;1;0;0;0;0;0;0;0;0;0;Backlog;2022-12-05T14:46:19.865+0100;;;;;;;;;;;;;;;;;;;;;;;;;;;;;;;;;;;;;;;;;;;;;;;;;;;;;;;;;;;;;;;;;;;;;;;;;;;;;;;;;;;;;;;;;;;;;;;;;;;;;;
HV-12310;Delivery Release 52-80-39c;Build;IN PRODUCTION;Michael Voss;null;null;null;Michael Voss;02.12.2022 16:56;null;52-80-39c;;12;4;0;0;0;0;0;0;0;0;63;In Progress;2022-12-02T16:56:58.038+0100;DELIVERED;2022-12-02T17:48:47.879+0100;DELIVERED INSTALLED;2022-12-05T09:31:49.516+0100;IN PRODUCTION;2022-12-05T20:56:09.342+0100;;;;;;;;;;;;;;;;;;;;;;;;;;;;;;;;;;;;;;;;;;;;;;;;;;;;;;;;;;;;;;;;;;;;;;;;;;;;;;;;;;;;;;;;;;;;;;;;
HV-12309;eRENT Missing RECURRING Service Charges;Bug;In Progress;Andre van Wingerden;eRENT;Pepper;High;Patrick Schwind;02.12.2022 13:30;eRENT;;;5;3;1;65;0;0;0;0;0;0;0;Backlog;2022-12-02T14:34:25.318+0100;Backlog;2022-12-02T14:36:15.660+0100;In Progress;2022-12-05T08:14:24.542+0100;;;;;;;;;;;;;;;;;;;;;;;;;;;;;;;;;;;;;;;;;;;;;;;;;;;;;;;;;;;;;;;;;;;;;;;;;;;;;;;;;;;;;;;;;;;;;;;;;;
HV-12307;eRENT Rental Chain - Migration Scrips Contracts & Orders;User Story;Backlog;Ahmed Tabook;eRENT;Pepper;High;Marcel Hoogenraad;02.12.2022 09:57;eRENT;;15.0;8;1;0;0;0;0;0;0;0;0;0;Backlog;2022-12-02T09:57:29.080+0100;;;;;;;;;;;;;;;;;;;;;;;;;;;;;;;;;;;;;;;;;;;;;;;;;;;;;;;;;;;;;;;;;;;;;;;;;;;;;;;;;;;;;;;;;;;;;;;;;;;;;;
HV-12306;Security hard-coded and DML buttons not present for Edi Conversion Table screen;Bug;Backlog;Andre van Wingerden;Security;Pepper;Medium;Dennis Schouten;01.12.2022 15:26;TMS;;;11;2;17;0;0;0;0;0;0;0;0;Backlog;2022-12-01T15:36:28.818+0100;Backlog;2022-12-02T08:29:25.691+0100;;;;;;;;;;;;;;;;;;;;;;;;;;;;;;;;;;;;;;;;;;;;;;;;;;;;;;;;;;;;;;;;;;;;;;;;;;;;;;;;;;;;;;;;;;;;;;;;;;;;
HV-12305;"REAL_TO_ETRAC fails ""ORA 01422: exact fetch returns more than requested number of rows """;Bug;IN PRODUCTION;Andre van Wingerden;eTrac;Pepper;Immediate;Berker Ahiska;01.12.2022 14:44;TMS;52-80-41;;18;11;0;0;0;0;0;0;0;25;63;New;2022-12-01T15:01:50.706+0100;Backlog;2022-12-01T15:33:55.077+0100;In Progress;2022-12-01T15:35:19.111+0100;IN CODE REVIEW;2022-12-01T15:35:55.123+0100;IN CODE REVIEW;2022-12-01T15:45:46.527+0100;Testable;2022-12-01T16:12:31.035+0100;Test OK;2022-12-01T16:36:17.478+0100;DELIVERED;2022-12-02T17:48:48.267+0100;DELIVERED INSTALLED;2022-12-05T09:31:49.731+0100;Delivered OK;2022-12-05T12:02:33.723+0100;IN PRODUCTION;2022-12-05T20:56:09.572+0100;;;;;;;;;;;;;;;;;;;;;;;;;;;;;;;;;;;;;;;;;;;;;;;;;;;;;;;;;;;;;;;;;;;;;;;;;;;;;;;;;;
HV-12295;Trucks (TRU) 3094 - Action child tab IR - Shipment No Hyperlink;User Story;Backlog;null;Equipment;Pepper;Medium;Berker Ahiska;30.11.2022 14:56;TMS;;;8;1;44;0;0;0;0;0;0;0;0;Backlog;2022-12-02T11:29:17.520+0100;;;;;;;;;;;;;;;;;;;;;;;;;;;;;;;;;;;;;;;;;;;;;;;;;;;;;;;;;;;;;;;;;;;;;;;;;;;;;;;;;;;;;;;;;;;;;;;;;;;;;;
HV-12294;Chassis (CCH) 3094 - Action child tab DML & IR page design ;User Story;Backlog;null;Equipment;Pepper;Medium;Berker Ahiska;30.11.2022 14:54;TMS;;;10;1;44;0;0;0;0;0;0;0;0;Backlog;2022-12-02T11:29:17.473+0100;;;;;;;;;;;;;;;;;;;;;;;;;;;;;;;;;;;;;;;;;;;;;;;;;;;;;;;;;;;;;;;;;;;;;;;;;;;;;;;;;;;;;;;;;;;;;;;;;;;;;;
HV-12293;3143 - CFR IBC Codes - New Page Design;User Story;Backlog;null;Product;Pepper;Medium;Berker Ahiska;29.11.2022 16:14;TMS;;;9;1;67;0;0;0;0;0;0;0;0;Backlog;2022-12-02T11:33:03.689+0100;;;;;;;;;;;;;;;;;;;;;;;;;;;;;;;;;;;;;;;;;;;;;;;;;;;;;;;;;;;;;;;;;;;;;;;;;;;;;;;;;;;;;;;;;;;;;;;;;;;;;;
HV-12291;3441 - CFR IBC Special Provisions - New Page Design;User Story;Backlog;null;Product;Pepper;Medium;Berker Ahiska;29.11.2022 16:14;TMS;;;9;1;67;0;0;0;0;0;0;0;0;Backlog;2022-12-02T11:33:03.659+0100;;;;;;;;;;;;;;;;;;;;;;;;;;;;;;;;;;;;;;;;;;;;;;;;;;;;;;;;;;;;;;;;;;;;;;;;;;;;;;;;;;;;;;;;;;;;;;;;;;;;;;
HV-12290;3709 - CFR Special Provisions - New Page Design;User Story;Backlog;null;Product;Pepper;Medium;Berker Ahiska;29.11.2022 16:14;TMS;;;10;1;67;0;0;0;0;0;0;0;0;Backlog;2022-12-02T11:33:03.628+0100;;;;;;;;;;;;;;;;;;;;;;;;;;;;;;;;;;;;;;;;;;;;;;;;;;;;;;;;;;;;;;;;;;;;;;;;;;;;;;;;;;;;;;;;;;;;;;;;;;;;;;
HV-12289;Extend solution for HV-11623 Talend Job OTD_EXT_BOOKING;Bug;In Clarification;Beate Weber;Carrier EDI;DBA;Medium;Robert Zwetsloot;29.11.2022 12:03;TMS;;;8;2;0;47;0;0;0;0;0;0;0;Backlog;2022-11-29T12:27:20.428+0100;In Clarification;2022-12-01T12:21:46.691+0100;;;;;;;;;;;;;;;;;;;;;;;;;;;;;;;;;;;;;;;;;;;;;;;;;;;;;;;;;;;;;;;;;;;;;;;;;;;;;;;;;;;;;;;;;;;;;;;;;;;;
HV-12288;False departure date in EDI Carrier bookings;Bug;IN PRODUCTION;Perry van Steenveldt;Carrier EDI;Salt;Immediate;Robert Zwetsloot;29.11.2022 11:52;TMS;52-80-41;;20;10;0;0;3;0;0;0;0;18;0;Backlog;2022-11-29T11:57:45.382+0100;In Progress;2022-11-29T12:03:41.931+0100;In Progress;2022-11-29T12:04:07.417+0100;IN CODE REVIEW;2022-11-29T15:22:57.002+0100;Testable;2022-11-29T15:49:00.317+0100;Test OK;2022-11-29T15:49:04.080+0100;DELIVERED;2022-11-30T09:50:06.461+0100;DELIVERED INSTALLED;2022-11-30T10:16:44.170+0100;Delivered OK;2022-11-30T12:35:11.945+0100;IN PRODUCTION;2022-11-30T20:14:46.966+0100;;;;;;;;;;;;;;;;;;;;;;;;;;;;;;;;;;;;;;;;;;;;;;;;;;;;;;;;;;;;;;;;;;;;;;;;;;;;;;;;;;;;
HV-12287;Delivery Release 52-80-39b;Build;IN PRODUCTION;Michael Voss;null;null;null;Michael Voss;29.11.2022 10:16;null;52-80-39b;;12;4;0;0;23;0;0;0;0;0;0;In Progress;2022-11-29T10:16:51.162+0100;DELIVERED;2022-11-30T09:50:06.442+0100;DELIVERED INSTALLED;2022-11-30T10:16:44.143+0100;IN PRODUCTION;2022-11-30T20:14:46.942+0100;;;;;;;;;;;;;;;;;;;;;;;;;;;;;;;;;;;;;;;;;;;;;;;;;;;;;;;;;;;;;;;;;;;;;;;;;;;;;;;;;;;;;;;;;;;;;;;;
HV-12286;Synthomer Transport Visibility via Transporeon;User Story;Backlog;null;EDI;eB;Medium;Robert Zwetsloot;29.11.2022 10:04;TMS;;;3;1;0;0;0;0;0;0;0;0;0;Backlog;2022-11-29T10:04:00.567+0100;;;;;;;;;;;;;;;;;;;;;;;;;;;;;;;;;;;;;;;;;;;;;;;;;;;;;;;;;;;;;;;;;;;;;;;;;;;;;;;;;;;;;;;;;;;;;;;;;;;;;;
HV-12284;Equipment History NDM2Vista error Master Type;Bug;IN PRODUCTION;Andre van Wingerden;Equipment;Pepper;Immediate;Wouter Baas;28.11.2022 15:58;TMS;52-80-41;;26;9;0;0;15;0;0;0;8;17;0;Backlog;2022-11-28T16:23:43.381+0100;Backlog;2022-11-28T16:27:09.857+0100;In Progress;2022-11-28T16:29:24.396+0100;Testable;2022-11-29T07:45:34.300+0100;Test OK;2022-11-29T15:55:22.598+0100;DELIVERED;2022-11-30T09:50:06.542+0100;DELIVERED INSTALLED;2022-11-30T10:16:44.248+0100;Delivered OK;2022-11-30T11:19:27.713+0100;IN PRODUCTION;2022-11-30T20:14:47.109+0100;;;;;;;;;;;;;;;;;;;;;;;;;;;;;;;;;;;;;;;;;;;;;;;;;;;;;;;;;;;;;;;;;;;;;;;;;;;;;;;;;;;;;;
HV-12282;Synthomer Transport Visibility via Transporeon;Epic;Backlog;null;EDI;eB;Medium;Johanna Klassen;28.11.2022 14:26;TMS;;;9;6;19;0;0;0;0;0;0;0;0;New;2022-11-28T14:28:14.919+0100;In Analysis;2022-11-29T10:03:36.209+0100;In Review;2022-11-29T10:03:45.006+0100;Reviewed;2022-11-29T10:03:55.525+0100;Approved;2022-11-29T10:03:57.939+0100;Backlog;2022-11-29T10:04:00.277+0100;;;;;;;;;;;;;;;;;;;;;;;;;;;;;;;;;;;;;;;;;;;;;;;;;;;;;;;;;;;;;;;;;;;;;;;;;;;;;;;;;;;;;;;;;;;;
HV-12281;Remove EDI CONF  CHECK logic from NDM2Vista and Action model;Epic;DEV REVIEWED NOT OK;Robert Zwetsloot;EDI;Salt;High;Robert Zwetsloot;28.11.2022 14:05;TMS;;;14;7;0;0;0;0;0;0;0;0;0;New;2022-11-28T14:05:53.066+0100;In Analysis;2022-11-28T14:38:55.930+0100;In Review;2022-11-28T14:38:59.831+0100;Reviewed;2022-11-28T14:39:08.641+0100;Approved;2022-11-28T14:39:23.227+0100;DEV IN REVIEW;2022-12-05T14:26:07.832+0100;DEV REVIEWED NOT OK;2022-12-05T14:26:09.764+0100;;;;;;;;;;;;;;;;;;;;;;;;;;;;;;;;;;;;;;;;;;;;;;;;;;;;;;;;;;;;;;;;;;;;;;;;;;;;;;;;;;;;;;;;;;
HV-12279;Description lenght of CFR keys are to short;Epic;Backlog;Marcel Hoogenraad;Product;Pepper;Medium;Stefanie Mueller;28.11.2022 11:12;TMS;;5.0;23;9;96;0;0;0;0;0;0;0;0;New;2022-11-28T11:12:18.611+0100;In Analysis;2022-11-28T11:51:44.084+0100;In Analysis;2022-11-29T16:15:54.380+0100;In Review;2022-11-29T16:42:37.459+0100;Reviewed;2022-11-29T16:53:32.182+0100;Approved;2022-11-29T16:53:35.350+0100;DEV IN REVIEW;2022-12-02T11:32:56.973+0100;DEV REVIEWED OK;2022-12-02T11:32:59.518+0100;Backlog;2022-12-02T11:33:03.617+0100;;;;;;;;;;;;;;;;;;;;;;;;;;;;;;;;;;;;;;;;;;;;;;;;;;;;;;;;;;;;;;;;;;;;;;;;;;;;;;;;;;;;;;
HV-12278;Equipment --> Change view Action table Truck and Chassis;Epic;Backlog;Marcel Hoogenraad;Equipment;Pepper;Medium;Stefanie Mueller;28.11.2022 11:10;TMS;;;16;8;96;0;0;0;0;0;0;0;0;New;2022-11-28T11:10:56.273+0100;In Analysis;2022-11-28T11:53:04.762+0100;In Review;2022-11-30T15:08:00.243+0100;Reviewed;2022-12-01T16:22:53.148+0100;Approved;2022-12-01T16:22:57.087+0100;DEV IN REVIEW;2022-12-02T10:49:09.742+0100;DEV REVIEWED OK;2022-12-02T11:29:08.454+0100;Backlog;2022-12-02T11:29:17.461+0100;;;;;;;;;;;;;;;;;;;;;;;;;;;;;;;;;;;;;;;;;;;;;;;;;;;;;;;;;;;;;;;;;;;;;;;;;;;;;;;;;;;;;;;;
HV-12277;Addendum to Add maximum days in History to Housekeeping Job - limit rows to be processed to 10 M;Improvement;In Progress;Thomas Deter;Housekeeping;Chili;Medium;Thomas Deter;25.11.2022 14:10;TMS;;1.0;7;3;0;0;0;0;0;0;0;0;0;In Clarification;2022-11-25T14:10:57.645+0100;In Progress;2022-11-25T14:11:03.273+0100;In Progress;2022-11-25T14:11:13.085+0100;;;;;;;;;;;;;;;;;;;;;;;;;;;;;;;;;;;;;;;;;;;;;;;;;;;;;;;;;;;;;;;;;;;;;;;;;;;;;;;;;;;;;;;;;;;;;;;;;;
HV-12276;Remove conditions on Re open external message;Epic;DEV REVIEWED OK;Robert Zwetsloot;ORD Interface;Salt;Medium;Ilhame Benzebir;25.11.2022 13:23;TMS;;2.0;15;8;0;0;0;0;0;0;0;0;0;New;2022-11-28T15:14:11.994+0100;In Analysis;2022-12-01T17:35:18.288+0100;In Analysis;2022-12-01T17:35:30.718+0100;In Review;2022-12-01T17:42:58.423+0100;Reviewed;2022-12-01T17:43:08.801+0100;Approved;2022-12-01T17:43:10.603+0100;DEV IN REVIEW;2022-12-05T14:08:23.718+0100;DEV REVIEWED OK;2022-12-05T14:08:28.579+0100;;;;;;;;;;;;;;;;;;;;;;;;;;;;;;;;;;;;;;;;;;;;;;;;;;;;;;;;;;;;;;;;;;;;;;;;;;;;;;;;;;;;;;;;
HV-12275;Add customer codes to BRE header for EDI Milestones;Epic;DEV IN REVIEW;Marcel Hoogenraad;Business Rule Engine;Pepper;Medium;Ilhame Benzebir;25.11.2022 12:54;TMS;;;27;16;166;5;0;0;0;0;0;0;0;New;2022-11-28T15:14:00.330+0100;In Analysis;2022-11-29T17:40:35.155+0100;In Analysis;2022-11-29T17:41:38.555+0100;In Review;2022-12-01T17:26:13.628+0100;Reviewed;2022-12-01T17:26:21.909+0100;Approved;2022-12-01T17:26:24.563+0100;DEV IN REVIEW;2022-12-02T11:35:18.433+0100;DEV REVIEWED OK;2022-12-02T11:35:20.187+0100;Backlog;2022-12-02T11:35:21.916+0100;On Hold;2022-12-02T16:53:26.723+0100;In Clarification;2022-12-02T16:54:59.059+0100;In Analysis;2022-12-02T17:28:47.859+0100;In Review;2022-12-02T17:28:52.023+0100;Reviewed;2022-12-02T17:28:59.466+0100;Approved;2022-12-02T17:29:01.717+0100;DEV IN REVIEW;2022-12-05T07:08:14.591+0100;;;;;;;;;;;;;;;;;;;;;;;;;;;;;;;;;;;;;;;;;;;;;;;;;;;;;;;;;;;;;;;;;;;;;;;;
HV-12274;Invoice printing batch fails completely if no printer is found ;Bug;Backlog;null;IBA;null;Medium;Oliver Manner-Romberg;24.11.2022 11:15;null;;;14;1;22;0;0;0;0;0;0;0;0;Backlog;2022-11-25T09:23:30.704+0100;;;;;;;;;;;;;;;;;;;;;;;;;;;;;;;;;;;;;;;;;;;;;;;;;;;;;;;;;;;;;;;;;;;;;;;;;;;;;;;;;;;;;;;;;;;;;;;;;;;;;;
HV-12273;IBA - Link to orginal invoice does not get printed on credit note in module RENT;Bug;Backlog;null;IBA;null;Medium;Marvin Dilg;24.11.2022 10:19;RENT;;;18;2;1;0;0;0;0;0;0;0;0;Backlog;2022-11-24T10:37:27.993+0100;Backlog;2022-11-24T11:45:42.256+0100;;;;;;;;;;;;;;;;;;;;;;;;;;;;;;;;;;;;;;;;;;;;;;;;;;;;;;;;;;;;;;;;;;;;;;;;;;;;;;;;;;;;;;;;;;;;;;;;;;;;
HV-12272;Port Base - Send Status Request ;Epic;PRELIMINARY ANALYSIS;null;null;null;High;Katja Mazat;23.11.2022 17:13;TMS;;;2;0;0;0;0;0;0;0;0;0;0;;;;;;;;;;;;;;;;;;;;;;;;;;;;;;;;;;;;;;;;;;;;;;;;;;;;;;;;;;;;;;;;;;;;;;;;;;;;;;;;;;;;;;;;;;;;;;;;;;;;;;;;
HV-12271;Test findings Carrier Realisations message;User Story;Testable;Bas Dijkgraaf;null;Salt;High;Robert Zwetsloot;22.11.2022 15:34;TMS;;1.0;20;9;0;19;136;0;32;0;0;0;0;Backlog;2022-11-22T15:37:09.991+0100;Backlog;2022-11-22T15:53:47.347+0100;In Progress;2022-11-23T10:59:03.289+0100;In Clarification;2022-11-23T11:58:52.157+0100;In Progress;2022-11-24T18:45:48.880+0100;In Clarification;2022-11-25T10:42:05.187+0100;In Progress;2022-11-25T12:46:52.689+0100;IN CODE REVIEW;2022-11-30T14:08:00.848+0100;Testable;2022-11-30T14:11:42.359+0100;;;;;;;;;;;;;;;;;;;;;;;;;;;;;;;;;;;;;;;;;;;;;;;;;;;;;;;;;;;;;;;;;;;;;;;;;;;;;;;;;;;;;;
HV-12261;MARE - EDI Estimate Intray - Conversion & Validation Improvements - Duplicate KINDOFCODE;Improvement;Test OK;Andre van Wingerden;MARE;Pepper;High;Berker Ahiska;22.11.2022 13:21;MARE;52-80-41;;18;6;3;0;0;0;0;1;0;0;0;Backlog;2022-11-22T16:35:09.038+0100;In Progress;2022-11-22T16:36:36.859+0100;IN CODE REVIEW;2022-11-22T16:36:38.732+0100;IN CODE REVIEW;2022-11-23T09:19:35.460+0100;Testable;2022-11-23T10:58:50.503+0100;Test OK;2022-11-23T11:14:20.810+0100;;;;;;;;;;;;;;;;;;;;;;;;;;;;;;;;;;;;;;;;;;;;;;;;;;;;;;;;;;;;;;;;;;;;;;;;;;;;;;;;;;;;;;;;;;;;
HV-12260;MARE - EDI Estimate Intray - Import Improvements - NETLOC;Improvement;Test OK;Andre van Wingerden;MARE;Pepper;High;Berker Ahiska;22.11.2022 12:20;MARE;52-80-41;;12;6;1;0;0;0;0;19;0;0;0;Backlog;2022-11-22T13:15:59.855+0100;Backlog;2022-11-22T14:02:15.510+0100;In Progress;2022-11-22T14:02:35.230+0100;IN CODE REVIEW;2022-11-22T14:59:42.872+0100;Testable;2022-11-23T10:58:43.437+0100;Test OK;2022-11-23T11:10:58.767+0100;;;;;;;;;;;;;;;;;;;;;;;;;;;;;;;;;;;;;;;;;;;;;;;;;;;;;;;;;;;;;;;;;;;;;;;;;;;;;;;;;;;;;;;;;;;;
HV-12259;MARE - EDI Estimate Intray - Conversion & Validation Improvements - MasterData Error;Improvement;Test OK;Andre van Wingerden;MARE;Pepper;High;Berker Ahiska;22.11.2022 10:27;MARE;52-80-41;;20;9;4;0;0;0;0;19;0;0;0;Backlog;2022-11-22T10:43:07.173+0100;Backlog;2022-11-22T14:59:52.314+0100;In Progress;2022-11-22T14:59:55.231+0100;IN CODE REVIEW;2022-11-22T15:47:16.480+0100;Testable;2022-11-23T10:58:37.419+0100;Test not OK;2022-11-23T11:06:07.371+0100;In Progress;2022-11-23T11:09:02.079+0100;Testable;2022-11-23T11:13:56.618+0100;Test OK;2022-11-23T11:19:35.628+0100;;;;;;;;;;;;;;;;;;;;;;;;;;;;;;;;;;;;;;;;;;;;;;;;;;;;;;;;;;;;;;;;;;;;;;;;;;;;;;;;;;;;;;
HV-12256;eRENT Double cost & revenue lines after pre-invoicing an invoiced period;Bug;Backlog;Andre van Wingerden;eRENT;Pepper;High;Patrick Schwind;21.11.2022 11:33;eRENT;;5.0;14;2;166;0;0;0;0;0;0;0;0;Backlog;2022-11-21T11:56:01.164+0100;Backlog;2022-11-28T10:29:34.206+0100;;;;;;;;;;;;;;;;;;;;;;;;;;;;;;;;;;;;;;;;;;;;;;;;;;;;;;;;;;;;;;;;;;;;;;;;;;;;;;;;;;;;;;;;;;;;;;;;;;;;
HV-12252;Delivery Release 52-80-40;Build;DELIVERED INSTALLED;Michael Voss;null;null;null;Michael Voss;21.11.2022 09:40;null;52-80-40;;27;3;0;0;51;0;0;0;0;0;18;In Progress;2022-11-21T09:40:45.799+0100;DELIVERED;2022-11-23T13:04:44.513+0100;DELIVERED INSTALLED;2022-11-24T07:49:57.224+0100;;;;;;;;;;;;;;;;;;;;;;;;;;;;;;;;;;;;;;;;;;;;;;;;;;;;;;;;;;;;;;;;;;;;;;;;;;;;;;;;;;;;;;;;;;;;;;;;;;
HV-12251;"RENT: ""t Accept IBC and Update Stock"" not working correctly";Bug;Backlog;null;Multilog Rental;null;Medium;Rainer Kohnert;18.11.2022 15:00;RENT;;;6;1;67;0;0;0;0;0;0;0;0;Backlog;2022-11-21T10:17:59.173+0100;;;;;;;;;;;;;;;;;;;;;;;;;;;;;;;;;;;;;;;;;;;;;;;;;;;;;;;;;;;;;;;;;;;;;;;;;;;;;;;;;;;;;;;;;;;;;;;;;;;;;;
HV-12250;Kraton Transport Visibility via P44;User Story;Closed;Gerd Menge;EDI;eB;Medium;Matthias Rom;18.11.2022 12:54;TMS;;;16;9;0;1;114;0;0;0;0;0;0;Backlog;2022-11-18T12:54:19.407+0100;In Progress;2022-11-18T14:05:31.689+0100;IN CODE REVIEW;2022-11-23T09:01:18.776+0100;Testable;2022-11-23T09:03:48.196+0100;DELIVERED;2022-11-23T09:03:53.330+0100;DELIVERED INSTALLED;2022-11-23T09:04:20.227+0100;Delivered OK;2022-11-23T09:04:56.345+0100;IN PRODUCTION;2022-11-23T09:05:03.349+0100;Closed;2022-11-24T09:32:43.253+0100;;;;;;;;;;;;;;;;;;;;;;;;;;;;;;;;;;;;;;;;;;;;;;;;;;;;;;;;;;;;;;;;;;;;;;;;;;;;;;;;;;;;;;
HV-12249;Fixing the Unit Test Failures - ut_tms_shipment_fin_ndm_pck;Unit Test;Closed;Arne Hattendorf;Unit Test;Chili;null;Bindhu Kannusamy;18.11.2022 12:26;null;;1.0;12;6;0;0;15;0;0;5;0;0;0;In Progress;2022-11-21T18:46:05.871+0100;IN CODE REVIEW;2022-11-22T10:26:53.922+0100;In Clarification;2022-11-22T15:21:24.744+0100;In Progress;2022-11-22T15:21:32.102+0100;IN CODE REVIEW;2022-11-22T15:22:04.904+0100;Closed;2022-11-22T16:47:27.843+0100;;;;;;;;;;;;;;;;;;;;;;;;;;;;;;;;;;;;;;;;;;;;;;;;;;;;;;;;;;;;;;;;;;;;;;;;;;;;;;;;;;;;;;;;;;;;
HV-12248;Kraton Transport Visibility via P44;Epic;Closed;Thomas Weber;EDI;eB;Medium;Johanna Klassen;18.11.2022 12:03;TMS;;2.0;20;13;0;1;115;0;0;0;0;0;24;New;2022-11-18T12:03:31.181+0100;In Analysis;2022-11-18T12:11:26.378+0100;In Review;2022-11-18T12:11:36.755+0100;Reviewed;2022-11-18T12:11:52.747+0100;Approved;2022-11-18T12:54:15.141+0100;Backlog;2022-11-18T12:54:19.124+0100;In Progress;2022-11-18T14:04:24.333+0100;Test OK;2022-11-23T09:07:21.651+0100;DELIVERED;2022-11-23T09:07:25.654+0100;DELIVERED INSTALLED;2022-11-24T09:32:27.811+0100;Delivered OK;2022-11-24T09:32:36.908+0100;IN PRODUCTION;2022-11-24T09:32:40.770+0100;Closed;2022-11-24T09:32:43.238+0100;;;;;;;;;;;;;;;;;;;;;;;;;;;;;;;;;;;;;;;;;;;;;;;;;;;;;;;;;;;;;;;;;;;;;;;;;;;;;;
HV-12246;Delivery Release 52-80-39a;Build;IN PRODUCTION;Michael Voss;null;null;null;Michael Voss;18.11.2022 10:20;null;52-80-39a;;16;4;0;0;0;0;0;0;0;0;71;In Progress;2022-11-18T10:20:12.898+0100;DELIVERED;2022-11-18T11:11:27.406+0100;DELIVERED INSTALLED;2022-11-21T10:36:52.513+0100;IN PRODUCTION;2022-11-26T11:14:49.134+0100;;;;;;;;;;;;;;;;;;;;;;;;;;;;;;;;;;;;;;;;;;;;;;;;;;;;;;;;;;;;;;;;;;;;;;;;;;;;;;;;;;;;;;;;;;;;;;;;
HV-12245;eRent: Button for change of OnHire-Date;Improvement;Backlog;Marcel Hoogenraad;eRENT;Pepper;Medium;Rainer Kohnert;18.11.2022 08:59;eRENT;;;13;7;2;0;0;0;0;0;0;0;0;Backlog;2022-11-18T11:31:08.370+0100;On Hold;2022-11-18T11:41:41.203+0100;PAUSED;2022-11-18T11:41:46.859+0100;IN CODE REVIEW;2022-11-18T11:41:49.211+0100;On Hold;2022-11-18T11:42:25.724+0100;New;2022-11-18T11:42:27.669+0100;Backlog;2022-11-18T11:42:34.445+0100;;;;;;;;;;;;;;;;;;;;;;;;;;;;;;;;;;;;;;;;;;;;;;;;;;;;;;;;;;;;;;;;;;;;;;;;;;;;;;;;;;;;;;;;;;
HV-12244;Copy Docs_to_EBIS_files in INTERFACE_DMS.DMS_DOC_ATTACHMENT;User Story;In Clarification;Beate Weber;EBIS;DBA;High;Robert Zwetsloot;17.11.2022 14:03;TMS;;;6;2;0;334;0;0;0;0;0;0;0;Backlog;2022-11-17T14:04:05.836+0100;In Clarification;2022-12-01T12:55:31.899+0100;;;;;;;;;;;;;;;;;;;;;;;;;;;;;;;;;;;;;;;;;;;;;;;;;;;;;;;;;;;;;;;;;;;;;;;;;;;;;;;;;;;;;;;;;;;;;;;;;;;;
HV-12243;Extend Document DMS Attachment from 78 to 4000;User Story;Test OK;Georgios Antoniadis;EBIS;Salt;Medium;Robert Zwetsloot;17.11.2022 13:45;TMS;52-80-41;1.0;14;5;24;0;92;0;0;0;2;0;0;Backlog;2022-11-17T13:46:12.043+0100;Backlog;2022-11-18T14:25:24.250+0100;In Progress;2022-11-18T14:28:52.090+0100;Testable;2022-11-22T11:10:37.184+0100;Test OK;2022-11-22T13:43:05.111+0100;;;;;;;;;;;;;;;;;;;;;;;;;;;;;;;;;;;;;;;;;;;;;;;;;;;;;;;;;;;;;;;;;;;;;;;;;;;;;;;;;;;;;;;;;;;;;;
HV-12242;Copy/Renumber Equipment - Generate New Equipment Numbers Validation for Eq No with 0;Improvement;Backlog;null;Equipment;Pepper;Medium;Berker Ahiska;16.11.2022 16:35;TMS;;;8;1;1;0;0;0;0;0;0;0;0;Backlog;2022-11-16T18:29:28.751+0100;;;;;;;;;;;;;;;;;;;;;;;;;;;;;;;;;;;;;;;;;;;;;;;;;;;;;;;;;;;;;;;;;;;;;;;;;;;;;;;;;;;;;;;;;;;;;;;;;;;;;;
HV-12241;Create Foreign key on External ID between EDI intray and EDI Intray lines ;Improvement;IN PRODUCTION;Andre van Wingerden;MARE;Pepper;Medium;Robert Zwetsloot;16.11.2022 15:40;MARE;52-80-39a;;16;10;0;0;3;0;0;1;1;20;71;Backlog;2022-11-16T15:40:42.915+0100;In Progress;2022-11-16T16:05:02.692+0100;In Progress;2022-11-17T07:48:06.490+0100;IN CODE REVIEW;2022-11-17T11:19:41.244+0100;Testable;2022-11-17T12:50:18.261+0100;Test OK;2022-11-17T14:17:24.301+0100;DELIVERED;2022-11-18T11:11:27.546+0100;DELIVERED INSTALLED;2022-11-21T10:36:52.681+0100;Delivered OK;2022-11-21T13:49:09.083+0100;IN PRODUCTION;2022-11-26T11:14:49.195+0100;;;;;;;;;;;;;;;;;;;;;;;;;;;;;;;;;;;;;;;;;;;;;;;;;;;;;;;;;;;;;;;;;;;;;;;;;;;;;;;;;;;;
HV-12235;Equipment Renumbering - Date of Renum check should use Prev. Date of Renum ;Improvement;Backlog;null;Equipment;Pepper;Medium;Berker Ahiska;16.11.2022 09:32;TMS;;;6;1;0;0;0;0;0;0;0;0;0;Backlog;2022-11-16T09:46:33.859+0100;;;;;;;;;;;;;;;;;;;;;;;;;;;;;;;;;;;;;;;;;;;;;;;;;;;;;;;;;;;;;;;;;;;;;;;;;;;;;;;;;;;;;;;;;;;;;;;;;;;;;;
HV-12234;Include default child tab security for mass data manipulation via running man;Improvement;Backlog;null;GUI APEX;Anise;Medium;Dennis Schouten;16.11.2022 09:21;null;;;8;1;0;0;0;0;0;0;0;0;0;Backlog;2022-11-16T10:01:28.212+0100;;;;;;;;;;;;;;;;;;;;;;;;;;;;;;;;;;;;;;;;;;;;;;;;;;;;;;;;;;;;;;;;;;;;;;;;;;;;;;;;;;;;;;;;;;;;;;;;;;;;;;
HV-12233;Delete/Remove field Date of Renumbering - RENUM_DATE;Improvement;Backlog;Marcel Hoogenraad;Equipment;Pepper;Medium;Berker Ahiska;16.11.2022 09:17;TMS;;;9;1;0;0;0;0;0;0;0;0;0;Backlog;2022-11-16T09:48:03.574+0100;;;;;;;;;;;;;;;;;;;;;;;;;;;;;;;;;;;;;;;;;;;;;;;;;;;;;;;;;;;;;;;;;;;;;;;;;;;;;;;;;;;;;;;;;;;;;;;;;;;;;;
HV-12232;Missing Product Information in Shunts;Bug;In Progress;Perry van Steenveldt;BOARDCOMPUTER;Salt;High;Robert Zwetsloot;15.11.2022 15:14;TMS;52-80-39d;4.0;25;3;0;0;0;0;0;0;0;0;0;Backlog;2022-11-15T15:33:11.805+0100;Backlog;2022-11-15T15:40:58.638+0100;In Progress;2022-11-15T15:41:35.325+0100;;;;;;;;;;;;;;;;;;;;;;;;;;;;;;;;;;;;;;;;;;;;;;;;;;;;;;;;;;;;;;;;;;;;;;;;;;;;;;;;;;;;;;;;;;;;;;;;;;
HV-12231;EDI Queue ID from file name to be parsed and stored into LS2Vista records;User Story;Backlog;null;Seeburger Interface;eB;Medium;Berker Ahiska;15.11.2022 12:57;MARE;;;17;1;406;0;0;0;0;0;0;0;0;Backlog;2022-12-02T11:31:45.714+0100;;;;;;;;;;;;;;;;;;;;;;;;;;;;;;;;;;;;;;;;;;;;;;;;;;;;;;;;;;;;;;;;;;;;;;;;;;;;;;;;;;;;;;;;;;;;;;;;;;;;;;
HV-12230;New Field: EDI Queue ID to LS2Vista 8762/8763;User Story;Backlog;Andre van Wingerden;MARE;Pepper;Medium;Berker Ahiska;15.11.2022 12:56;MARE;;5.0;25;1;406;0;0;0;0;0;0;0;0;Backlog;2022-12-02T11:31:45.753+0100;;;;;;;;;;;;;;;;;;;;;;;;;;;;;;;;;;;;;;;;;;;;;;;;;;;;;;;;;;;;;;;;;;;;;;;;;;;;;;;;;;;;;;;;;;;;;;;;;;;;;;
HV-12229;Product: Technical name Vista -> Ortec;User Story;DELIVERED INSTALLED;Beate Weber;ORD Interface;DBA;Medium;Robert Zwetsloot;15.11.2022 12:12;TMS;;;13;6;0;22;3;0;0;0;143;2;0;Backlog;2022-11-15T12:12:35.702+0100;In Progress;2022-11-16T10:23:56.285+0100;Testable;2022-11-16T14:04:30.750+0100;Test OK;2022-11-22T13:35:43.890+0100;DELIVERED;2022-11-22T16:08:17.467+0100;DELIVERED INSTALLED;2022-11-22T16:08:26.103+0100;;;;;;;;;;;;;;;;;;;;;;;;;;;;;;;;;;;;;;;;;;;;;;;;;;;;;;;;;;;;;;;;;;;;;;;;;;;;;;;;;;;;;;;;;;;;
HV-12228;New Field : RQ mark required checkbox;User Story;Backlog;null;Product;Pepper;Medium;Berker Ahiska;15.11.2022 11:07;TMS;;;13;1;408;0;0;0;0;0;0;0;0;Backlog;2022-12-02T11:32:34.884+0100;;;;;;;;;;;;;;;;;;;;;;;;;;;;;;;;;;;;;;;;;;;;;;;;;;;;;;;;;;;;;;;;;;;;;;;;;;;;;;;;;;;;;;;;;;;;;;;;;;;;;;
HV-12223;Vista Product Field RQ on CFR page;Epic;Backlog;Marcel Hoogenraad;Product;Pepper;Medium;Stefanie Mueller;14.11.2022 13:51;TMS;;5.0;25;9;429;0;0;0;0;0;0;0;0;New;2022-11-14T13:51:41.717+0100;In Analysis;2022-11-14T14:21:11.654+0100;In Analysis;2022-11-15T11:05:06.573+0100;In Review;2022-11-15T11:26:31.219+0100;Reviewed;2022-11-15T13:49:28.717+0100;Approved;2022-11-15T13:49:31.676+0100;DEV IN REVIEW;2022-12-02T11:32:31.216+0100;DEV REVIEWED OK;2022-12-02T11:32:33.043+0100;Backlog;2022-12-02T11:32:34.873+0100;;;;;;;;;;;;;;;;;;;;;;;;;;;;;;;;;;;;;;;;;;;;;;;;;;;;;;;;;;;;;;;;;;;;;;;;;;;;;;;;;;;;;;
HV-12222;RENT: System-Stop after add OET with existing Order-papers;Bug;Closed;Georgios Antoniadis;Multilog Rental;Salt;High;Rainer Kohnert;14.11.2022 12:57;RENT;;;15;7;0;19;6;0;0;0;0;0;0;Backlog;2022-11-14T12:59:15.169+0100;In Progress;2022-11-15T08:30:54.239+0100;In Progress;2022-11-15T09:10:12.458+0100;Testable;2022-11-15T15:14:25.024+0100;Testable;2022-11-15T15:48:17.525+0100;On Hold;2022-11-15T15:48:29.580+0100;Closed;2022-11-15T15:53:48.469+0100;;;;;;;;;;;;;;;;;;;;;;;;;;;;;;;;;;;;;;;;;;;;;;;;;;;;;;;;;;;;;;;;;;;;;;;;;;;;;;;;;;;;;;;;;;
HV-12221;LS2Vista Interface - Using of EDIQueueID from File Name;Epic;Backlog;Marcel Hoogenraad;MARE;Pepper;Medium;Carolin Schmitz;14.11.2022 12:01;MARE;;5.0;25;9;431;0;0;0;0;0;0;0;0;New;2022-11-14T12:01:57.245+0100;In Analysis;2022-11-14T14:27:28.679+0100;In Analysis;2022-11-15T13:04:35.385+0100;In Review;2022-11-15T14:16:53.338+0100;Reviewed;2022-11-15T14:29:42.038+0100;Approved;2022-11-15T14:29:44.894+0100;DEV IN REVIEW;2022-12-02T11:31:38.510+0100;DEV REVIEWED OK;2022-12-02T11:31:41.479+0100;Backlog;2022-12-02T11:31:45.700+0100;;;;;;;;;;;;;;;;;;;;;;;;;;;;;;;;;;;;;;;;;;;;;;;;;;;;;;;;;;;;;;;;;;;;;;;;;;;;;;;;;;;;;;
HV-12218;xServer detailed and basic toll update Czech Republic;Incident;Closed;null;null;Salt;Medium;Dennis Schouten;14.11.2022 08:45;null;;;2;2;0;0;0;0;0;0;0;0;0;On Hold;2022-11-14T09:08:10.728+0100;Closed;2022-11-14T09:08:48.545+0100;;;;;;;;;;;;;;;;;;;;;;;;;;;;;;;;;;;;;;;;;;;;;;;;;;;;;;;;;;;;;;;;;;;;;;;;;;;;;;;;;;;;;;;;;;;;;;;;;;;;
HV-12217;Improve BRE Rule Processing;Improvement;IN PRODUCTION;Andre van Wingerden;Business Rule Engine;Pepper;High;Marcel Hoogenraad;11.11.2022 15:30;TMS;52-80-39a;2.0;21;10;88;5;2;0;0;21;25;20;71;Backlog;2022-11-11T15:34:49.469+0100;Backlog;2022-11-15T08:17:31.431+0100;In Progress;2022-11-15T13:55:25.437+0100;IN CODE REVIEW;2022-11-15T16:26:17.531+0100;Testable;2022-11-16T14:01:02.526+0100;Test OK;2022-11-17T15:02:30.294+0100;DELIVERED;2022-11-18T11:11:27.424+0100;DELIVERED INSTALLED;2022-11-21T10:36:52.627+0100;Delivered OK;2022-11-21T11:10:45.248+0100;IN PRODUCTION;2022-11-26T11:14:49.150+0100;;;;;;;;;;;;;;;;;;;;;;;;;;;;;;;;;;;;;;;;;;;;;;;;;;;;;;;;;;;;;;;;;;;;;;;;;;;;;;;;;;;;
HV-12216;BRE - Replacement of Ext Msg generation trigger for EQ  ;Improvement;Backlog;null;Business Rule Engine;Pepper;Medium;Berker Ahiska;11.11.2022 10:03;TMS;;;1;1;0;0;0;0;0;0;0;0;0;Backlog;2022-11-11T10:46:21.673+0100;;;;;;;;;;;;;;;;;;;;;;;;;;;;;;;;;;;;;;;;;;;;;;;;;;;;;;;;;;;;;;;;;;;;;;;;;;;;;;;;;;;;;;;;;;;;;;;;;;;;;;
HV-12215;DISTANCE_TOLLCOST does not take into account empty dirty TKC logic;User Story;Backlog;Ulf Hensel;xServer;Salt;Medium;Dennis Schouten;11.11.2022 09:50;TMS;;;17;1;3;0;0;0;0;0;0;0;0;Backlog;2022-11-11T13:35:41.618+0100;;;;;;;;;;;;;;;;;;;;;;;;;;;;;;;;;;;;;;;;;;;;;;;;;;;;;;;;;;;;;;;;;;;;;;;;;;;;;;;;;;;;;;;;;;;;;;;;;;;;;;
HV-12212;RENT: Keyboard entry of product not accepted in Return-OET;Bug;Backlog;null;Multilog Rental;Chili;Medium;Rainer Kohnert;10.11.2022 14:22;RENT;;2.0;9;2;0;0;0;0;0;0;0;0;0;New;2022-11-10T14:29:50.170+0100;Backlog;2022-11-10T14:30:01.854+0100;;;;;;;;;;;;;;;;;;;;;;;;;;;;;;;;;;;;;;;;;;;;;;;;;;;;;;;;;;;;;;;;;;;;;;;;;;;;;;;;;;;;;;;;;;;;;;;;;;;;
HV-12210;REQ;Epic;PRELIMINARY ANALYSIS;null;null;null;Medium;Matthias Rom;10.11.2022 14:11;TMS;;;0;0;0;0;0;0;0;0;0;0;0;;;;;;;;;;;;;;;;;;;;;;;;;;;;;;;;;;;;;;;;;;;;;;;;;;;;;;;;;;;;;;;;;;;;;;;;;;;;;;;;;;;;;;;;;;;;;;;;;;;;;;;;
HV-12209;Arkema Transport Visibility via P44;User Story;Closed;Gerd Menge;null;eB;High;Thomas Weber;10.11.2022 10:25;TMS;;;15;10;25;0;169;0;0;0;0;0;0;New;2022-11-11T11:34:22.502+0100;Backlog;2022-11-11T12:17:21.684+0100;In Progress;2022-11-11T12:18:59.012+0100;IN CODE REVIEW;2022-11-18T14:18:25.848+0100;Testable;2022-11-18T14:27:58.783+0100;DELIVERED;2022-11-18T14:28:06.120+0100;DELIVERED INSTALLED;2022-11-18T14:49:25.435+0100;Delivered OK;2022-11-18T14:49:42.933+0100;IN PRODUCTION;2022-11-21T08:01:27.544+0100;Closed;2022-11-21T08:06:09.025+0100;;;;;;;;;;;;;;;;;;;;;;;;;;;;;;;;;;;;;;;;;;;;;;;;;;;;;;;;;;;;;;;;;;;;;;;;;;;;;;;;;;;;
HV-12208;EDI Address Data details validation;User Story;Backlog;null;EDI;Salt;Medium;Berker Ahiska;09.11.2022 15:20;TMS;;;12;1;287;0;0;0;0;0;0;0;0;Backlog;2022-11-21T15:01:05.554+0100;;;;;;;;;;;;;;;;;;;;;;;;;;;;;;;;;;;;;;;;;;;;;;;;;;;;;;;;;;;;;;;;;;;;;;;;;;;;;;;;;;;;;;;;;;;;;;;;;;;;;;
HV-12207;"Purchase orders HOYEANTW, missing INPUT criterium ""Equipment Usage""";Bug;IN PRODUCTION;Bas Dijkgraaf;Purchase  Order;Salt;High;Mark Pieterse;09.11.2022 09:59;TMS;52-80-39a;1.0;29;8;0;165;3;0;0;0;3;43;71;Backlog;2022-11-09T10:36:49.327+0100;In Progress;2022-11-16T08:17:21.881+0100;Testable;2022-11-16T12:15:47.786+0100;Test OK;2022-11-16T15:33:25.847+0100;DELIVERED;2022-11-18T11:11:27.603+0100;DELIVERED INSTALLED;2022-11-21T10:36:52.735+0100;Delivered OK;2022-11-21T11:33:27.611+0100;IN PRODUCTION;2022-11-26T11:14:49.237+0100;;;;;;;;;;;;;;;;;;;;;;;;;;;;;;;;;;;;;;;;;;;;;;;;;;;;;;;;;;;;;;;;;;;;;;;;;;;;;;;;;;;;;;;;
HV-12205;Talend job PORTAL delays and picks random entries;Improvement;On Hold;null;Portal;DBA;Medium;Diana Luft;08.11.2022 16:05;null;;;4;2;0;24;0;0;0;0;0;0;0;Backlog;2022-11-08T16:07:32.261+0100;On Hold;2022-11-09T16:18:37.902+0100;;;;;;;;;;;;;;;;;;;;;;;;;;;;;;;;;;;;;;;;;;;;;;;;;;;;;;;;;;;;;;;;;;;;;;;;;;;;;;;;;;;;;;;;;;;;;;;;;;;;
HV-12204;Missing error-handling in CALC_RENTAL_STOCK batch job;Bug;IN PRODUCTION;Andre van Wingerden;Duration Orders;Pepper;High;Rainer Kohnert;08.11.2022 14:22;eRENT;52-80-39;;25;10;0;0;0;0;0;0;18;7;40;Backlog;2022-11-08T14:54:35.548+0100;Backlog;2022-11-08T14:54:47.412+0100;In Progress;2022-11-08T14:56:37.823+0100;IN CODE REVIEW;2022-11-08T14:57:32.011+0100;Testable;2022-11-08T15:16:10.672+0100;Test OK;2022-11-09T10:09:19.731+0100;DELIVERED;2022-11-09T17:42:59.885+0100;DELIVERED INSTALLED;2022-11-11T10:36:21.272+0100;Delivered OK;2022-11-15T10:51:29.913+0100;IN PRODUCTION;2022-11-26T11:14:26.724+0100;;;;;;;;;;;;;;;;;;;;;;;;;;;;;;;;;;;;;;;;;;;;;;;;;;;;;;;;;;;;;;;;;;;;;;;;;;;;;;;;;;;;
HV-12194;Sequence rental.IBC_ORDERS_SEQ  utilized by > 40%;User Story;IN PRODUCTION;Temuri Isabekovi;null;Chili;Medium;Thomas Deter;08.11.2022 10:56;TMS;52-80-39;;27;15;0;0;2;0;0;1;0;26;39;New;2022-11-08T10:56:42.780+0100;In Clarification;2022-11-08T10:56:53.684+0100;In Progress;2022-11-08T10:56:57.079+0100;IN CODE REVIEW;2022-11-08T13:41:23.178+0100;Testable;2022-11-08T14:59:29.130+0100;Test OK;2022-11-08T15:04:18.245+0100;DELIVERED;2022-11-09T17:42:57.277+0100;In Clarification;2022-11-10T13:57:42.083+0100;In Progress;2022-11-10T13:57:45.657+0100;Testable;2022-11-10T13:58:12.492+0100;Test OK;2022-11-10T13:58:15.903+0100;DELIVERED;2022-11-10T14:37:31.723+0100;DELIVERED INSTALLED;2022-11-11T10:36:18.774+0100;Delivered OK;2022-11-18T15:12:48.782+0100;IN PRODUCTION;2022-11-26T11:14:23.789+0100;;;;;;;;;;;;;;;;;;;;;;;;;;;;;;;;;;;;;;;;;;;;;;;;;;;;;;;;;;;;;;;;;;;;;;;;;;
HV-12193;MARE - Check behavior of date fields filled via date picker;Kernel-task;Test OK;Berker Ahiska;Kernel;null;Medium;Stefan Pchalek;08.11.2022 08:42;null;;;7;2;0;0;0;0;0;0;192;0;0;Testable;2022-11-23T14:37:47.781+0100;Test OK;2022-12-01T15:36:30.417+0100;;;;;;;;;;;;;;;;;;;;;;;;;;;;;;;;;;;;;;;;;;;;;;;;;;;;;;;;;;;;;;;;;;;;;;;;;;;;;;;;;;;;;;;;;;;;;;;;;;;;
HV-12192;eRENT - Check behavior of date fields filled via date picker;Kernel-task;Test OK;Rainer Kohnert;eRENT;null;Medium;Stefan Pchalek;08.11.2022 08:41;null;;;9;2;0;0;0;0;0;0;192;0;0;Testable;2022-11-23T14:37:44.890+0100;Test OK;2022-12-01T15:29:49.090+0100;;;;;;;;;;;;;;;;;;;;;;;;;;;;;;;;;;;;;;;;;;;;;;;;;;;;;;;;;;;;;;;;;;;;;;;;;;;;;;;;;;;;;;;;;;;;;;;;;;;;
HV-12191;RENT - Check behavior of date fields filled via date picker;Kernel-task;Test OK;Rainer Kohnert;Kernel;null;Medium;Stefan Pchalek;08.11.2022 08:39;null;;;10;2;0;0;0;0;0;0;120;0;0;Testable;2022-11-23T14:37:41.974+0100;Test OK;2022-11-28T14:50:50.174+0100;;;;;;;;;;;;;;;;;;;;;;;;;;;;;;;;;;;;;;;;;;;;;;;;;;;;;;;;;;;;;;;;;;;;;;;;;;;;;;;;;;;;;;;;;;;;;;;;;;;;
HV-12190;OPS - Check behavior of date fields filled via date picker;Kernel-task;Test OK;Mark Pieterse;Kernel;null;Medium;Stefan Pchalek;08.11.2022 08:37;null;;;9;2;0;0;0;0;0;0;42;0;0;Testable;2022-11-23T14:37:39.103+0100;Test OK;2022-11-25T09:17:41.292+0100;;;;;;;;;;;;;;;;;;;;;;;;;;;;;;;;;;;;;;;;;;;;;;;;;;;;;;;;;;;;;;;;;;;;;;;;;;;;;;;;;;;;;;;;;;;;;;;;;;;;
HV-12189;S&C - Check behavior of date fields filled via date picker;Kernel-task;Test OK;Mark Pieterse;Kernel;null;Medium;Stefan Pchalek;08.11.2022 08:35;null;;;12;2;0;0;0;0;0;0;42;0;0;Testable;2022-11-23T14:37:35.374+0100;Test OK;2022-11-25T09:17:33.818+0100;;;;;;;;;;;;;;;;;;;;;;;;;;;;;;;;;;;;;;;;;;;;;;;;;;;;;;;;;;;;;;;;;;;;;;;;;;;;;;;;;;;;;;;;;;;;;;;;;;;;
HV-12188;IBA - Check behavior of date fields filled via date picker;Kernel-task;Test OK;Stefan Pchalek;IBA;null;Medium;Stefan Pchalek;08.11.2022 08:34;null;;;6;2;0;0;0;0;0;0;0;0;0;Testable;2022-11-23T14:37:19.203+0100;Test OK;2022-11-23T14:37:52.191+0100;;;;;;;;;;;;;;;;;;;;;;;;;;;;;;;;;;;;;;;;;;;;;;;;;;;;;;;;;;;;;;;;;;;;;;;;;;;;;;;;;;;;;;;;;;;;;;;;;;;;
HV-12187;Delivery Release 52-80-39;Build;IN PRODUCTION;Michael Voss;null;null;null;Michael Voss;07.11.2022 18:39;null;52-80-39;;72;4;0;0;47;0;0;0;0;0;40;In Progress;2022-11-07T18:39:11.564+0100;DELIVERED;2022-11-09T17:42:55.284+0100;DELIVERED INSTALLED;2022-11-11T10:36:18.761+0100;IN PRODUCTION;2022-11-26T11:14:23.769+0100;;;;;;;;;;;;;;;;;;;;;;;;;;;;;;;;;;;;;;;;;;;;;;;;;;;;;;;;;;;;;;;;;;;;;;;;;;;;;;;;;;;;;;;;;;;;;;;;
HV-12186;EDI Partner data conversion for existing data of COMPANY.EDI_PARTNER;User Story;Backlog;null;EDI;Salt;High;Berker Ahiska;07.11.2022 15:19;TMS;;;14;1;1;0;0;0;0;0;0;0;0;Backlog;2022-11-07T16:26:32.671+0100;;;;;;;;;;;;;;;;;;;;;;;;;;;;;;;;;;;;;;;;;;;;;;;;;;;;;;;;;;;;;;;;;;;;;;;;;;;;;;;;;;;;;;;;;;;;;;;;;;;;;;
HV-12185;Sorting - Reservation Projects Userstory;User Story;Backlog;Ahmed Tabook;RESERVATION;Pepper;Medium;Patrick Schwind;07.11.2022 14:29;RESERVATION;;5.0;25;3;595;0;0;0;0;0;0;0;0;New;2022-11-07T14:29:47.478+0100;Backlog;2022-11-16T10:40:07.099+0100;Backlog;2022-12-02T09:39:36.745+0100;;;;;;;;;;;;;;;;;;;;;;;;;;;;;;;;;;;;;;;;;;;;;;;;;;;;;;;;;;;;;;;;;;;;;;;;;;;;;;;;;;;;;;;;;;;;;;;;;;
HV-12182;Delivery Release 52-80-38b;Build;Closed;Michael Voss;null;null;null;Michael Voss;04.11.2022 19:47;null;52-80-38b;;16;5;0;0;85;0;0;0;0;0;3;In Progress;2022-11-04T19:47:58.500+0100;DELIVERED;2022-11-08T09:18:19.633+0100;DELIVERED INSTALLED;2022-11-08T12:53:32.579+0100;IN PRODUCTION;2022-11-14T20:21:22.179+0100;Closed;2022-11-15T08:37:26.845+0100;;;;;;;;;;;;;;;;;;;;;;;;;;;;;;;;;;;;;;;;;;;;;;;;;;;;;;;;;;;;;;;;;;;;;;;;;;;;;;;;;;;;;;;;;;;;;;
HV-12181;Remove calendar from page 30125;Bug;Backlog;null;Purchase Agreements;Salt;High;Robert Zwetsloot;04.11.2022 16:20;TMS;;;4;1;0;0;0;0;0;0;0;0;0;Backlog;2022-11-04T16:22:40.035+0100;;;;;;;;;;;;;;;;;;;;;;;;;;;;;;;;;;;;;;;;;;;;;;;;;;;;;;;;;;;;;;;;;;;;;;;;;;;;;;;;;;;;;;;;;;;;;;;;;;;;;;
HV-12180;Evonik Transport Visibility via myleo;User Story;DELIVERED INSTALLED;Gerd Menge;EDI;eB;Medium;Thomas Weber;04.11.2022 14:55;TMS;;8.0;12;6;232;100;405;0;0;0;0;0;1;Backlog;2022-11-14T07:55:09.043+0100;In Progress;2022-11-18T12:18:40.155+0100;IN CODE REVIEW;2022-12-05T10:04:50.725+0100;Testable;2022-12-05T10:14:05.160+0100;DELIVERED;2022-12-05T10:14:11.553+0100;DELIVERED INSTALLED;2022-12-05T11:59:19.191+0100;;;;;;;;;;;;;;;;;;;;;;;;;;;;;;;;;;;;;;;;;;;;;;;;;;;;;;;;;;;;;;;;;;;;;;;;;;;;;;;;;;;;;;;;;;;;
HV-12178;RENT: Not needed reference for equipment in AddRev of Return Order;Improvement;Backlog;null;Multilog Rental;Chili;Medium;Rainer Kohnert;04.11.2022 12:22;RENT;;;5;1;335;0;0;0;0;0;0;0;0;Backlog;2022-11-18T11:33:42.557+0100;;;;;;;;;;;;;;;;;;;;;;;;;;;;;;;;;;;;;;;;;;;;;;;;;;;;;;;;;;;;;;;;;;;;;;;;;;;;;;;;;;;;;;;;;;;;;;;;;;;;;;
HV-12177;Arkema Transport Visibility via P44;Epic;Closed;Thomas Weber;null;eB;High;Johanna Klassen;03.11.2022 11:44;TMS;;2.0;17;9;166;25;235;0;0;0;0;0;0;New;2022-11-07T13:17:57.911+0100;Backlog;2022-11-10T10:25:31.355+0100;In Progress;2022-11-11T12:18:59.020+0100;Test OK;2022-11-21T08:04:09.145+0100;DELIVERED;2022-11-21T08:04:12.573+0100;DELIVERED INSTALLED;2022-11-21T08:04:16.400+0100;Delivered OK;2022-11-21T08:06:01.164+0100;IN PRODUCTION;2022-11-21T08:06:05.271+0100;Closed;2022-11-21T08:06:09.011+0100;;;;;;;;;;;;;;;;;;;;;;;;;;;;;;;;;;;;;;;;;;;;;;;;;;;;;;;;;;;;;;;;;;;;;;;;;;;;;;;;;;;;;;
HV-12176;Delivery Release 52-80-38a;Build;Closed;Michael Voss;null;null;null;Michael Voss;03.11.2022 10:28;null;52-80-38a;;14;5;0;0;1;0;0;0;0;0;1;In Progress;2022-11-03T10:28:21.603+0100;DELIVERED;2022-11-03T12:23:36.118+0100;DELIVERED INSTALLED;2022-11-03T14:02:27.126+0100;IN PRODUCTION;2022-11-14T20:21:10.310+0100;Closed;2022-11-15T08:37:22.380+0100;;;;;;;;;;;;;;;;;;;;;;;;;;;;;;;;;;;;;;;;;;;;;;;;;;;;;;;;;;;;;;;;;;;;;;;;;;;;;;;;;;;;;;;;;;;;;;
HV-12175;Add ORD planning status to EDI.EDI_STATUS and ALCATEL.ALCATEL_MACRO;User Story;IN PRODUCTION;Bas Dijkgraaf;ORD Interface;Salt;High;Robert Zwetsloot;02.11.2022 15:24;TMS;52-80-39;;19;9;18;0;2;0;0;0;0;148;40;Backlog;2022-11-02T15:24:15.562+0100;Backlog;2022-11-03T10:14:13.044+0100;In Progress;2022-11-03T10:25:14.385+0100;Testable;2022-11-03T12:36:27.218+0100;Test OK;2022-11-03T13:33:43.574+0100;DELIVERED;2022-11-09T17:42:58.978+0100;DELIVERED INSTALLED;2022-11-11T10:36:20.367+0100;Delivered OK;2022-11-21T15:28:42.578+0100;IN PRODUCTION;2022-11-26T11:14:25.548+0100;;;;;;;;;;;;;;;;;;;;;;;;;;;;;;;;;;;;;;;;;;;;;;;;;;;;;;;;;;;;;;;;;;;;;;;;;;;;;;;;;;;;;;
HV-12174;Equipment Bulk Update - Extend Bulk Settings with EQM;Improvement;IN CODE REVIEW;Ahmed Tabook;Equipment;Pepper;Medium;Marcel Hoogenraad;02.11.2022 13:39;TMS;;7.0;18;8;0;22;501;0;0;145;0;0;0;Backlog;2022-11-02T13:41:58.353+0100;Backlog;2022-11-02T13:47:34.155+0100;In Progress;2022-11-03T11:47:54.016+0100;IN CODE REVIEW;2022-11-18T13:48:13.739+0100;On Hold;2022-11-24T15:07:07.295+0100;PAUSED;2022-11-24T15:07:13.141+0100;In Progress;2022-11-24T15:07:15.516+0100;IN CODE REVIEW;2022-11-30T10:54:19.967+0100;;;;;;;;;;;;;;;;;;;;;;;;;;;;;;;;;;;;;;;;;;;;;;;;;;;;;;;;;;;;;;;;;;;;;;;;;;;;;;;;;;;;;;;;
HV-12173;Reservation - On hire screen is opened when selecting an equipment via equipment search;Bug;Closed;Andre van Wingerden;RESERVATION;Pepper;SHOWSTOPPER TST;Patrick Schwind;02.11.2022 11:03;RESERVATION;52-80-38a;;16;10;2;0;0;0;0;0;0;21;1;Backlog;2022-11-02T13:08:12.904+0100;In Progress;2022-11-02T13:56:48.699+0100;In Progress;2022-11-02T13:56:54.161+0100;Testable;2022-11-02T14:15:02.506+0100;Test OK;2022-11-02T14:36:25.795+0100;DELIVERED;2022-11-03T12:23:36.375+0100;DELIVERED INSTALLED;2022-11-03T14:02:27.306+0100;Delivered OK;2022-11-03T14:29:22.880+0100;IN PRODUCTION;2022-11-14T20:21:10.336+0100;Closed;2022-11-15T08:37:22.391+0100;;;;;;;;;;;;;;;;;;;;;;;;;;;;;;;;;;;;;;;;;;;;;;;;;;;;;;;;;;;;;;;;;;;;;;;;;;;;;;;;;;;;
HV-12172;eRENT Import function (P8853) to on hire equipment does not work;Bug;Closed;Andre van Wingerden;eRENT;Pepper;Low;Patrick Schwind;02.11.2022 10:25;eRENT;;;19;6;1;3;0;0;0;0;0;0;0;Backlog;2022-11-02T10:34:26.733+0100;Backlog;2022-11-02T12:20:58.133+0100;In Progress;2022-11-02T15:42:55.945+0100;In Progress;2022-11-02T16:10:26.986+0100;On Hold;2022-11-02T16:10:52.699+0100;Closed;2022-11-02T16:11:10.740+0100;;;;;;;;;;;;;;;;;;;;;;;;;;;;;;;;;;;;;;;;;;;;;;;;;;;;;;;;;;;;;;;;;;;;;;;;;;;;;;;;;;;;;;;;;;;;
HV-12171;New objects for projects PAM, CICD and Get rid of public rights;User Story;IN PRODUCTION;Viktor Miller;null;DBA;Medium;Detlef Juergens;02.11.2022 09:02;null;52-80-39;;24;14;0;0;29;0;0;0;38;29;24;In Clarification;2022-11-02T09:16:42.083+0100;In Progress;2022-11-02T09:16:50.318+0100;In Progress;2022-11-02T09:17:38.388+0100;IN CODE REVIEW;2022-11-03T14:30:33.860+0100;Testable;2022-11-03T14:31:27.869+0100;Test not OK;2022-11-04T12:51:11.222+0100;In Clarification;2022-11-08T16:40:10.435+0100;In Progress;2022-11-08T16:40:14.419+0100;Testable;2022-11-08T16:40:26.701+0100;Test OK;2022-11-09T08:46:09.537+0100;DELIVERED;2022-11-10T13:51:04.083+0100;DELIVERED INSTALLED;2022-11-11T14:38:25.413+0100;Delivered OK;2022-11-11T16:32:24.657+0100;IN PRODUCTION;2022-11-26T11:14:25.482+0100;;;;;;;;;;;;;;;;;;;;;;;;;;;;;;;;;;;;;;;;;;;;;;;;;;;;;;;;;;;;;;;;;;;;;;;;;;;;
HV-12170;Error in invoice combined batch leads to infinite loop and rollback;Bug;IN PRODUCTION;Perry van Steenveldt;IBA;Ingwer;High;Oliver Manner-Romberg;01.11.2022 16:19;TMS;52-80-39;3.0;29;10;4;0;42;0;0;0;18;127;40;New;2022-11-01T16:48:37.322+0100;Backlog;2022-11-01T16:48:53.126+0100;Backlog;2022-11-01T21:02:15.784+0100;In Progress;2022-11-01T21:02:24.788+0100;Testable;2022-11-03T15:21:27.584+0100;Test OK;2022-11-04T10:13:17.447+0100;DELIVERED;2022-11-09T17:42:59.980+0100;DELIVERED INSTALLED;2022-11-11T10:36:21.344+0100;Delivered OK;2022-11-15T10:54:20.786+0100;IN PRODUCTION;2022-11-26T11:14:26.807+0100;;;;;;;;;;;;;;;;;;;;;;;;;;;;;;;;;;;;;;;;;;;;;;;;;;;;;;;;;;;;;;;;;;;;;;;;;;;;;;;;;;;;
HV-12169;New xServer cannot cope with a product with tunnel restriction code A ;User Story;Backlog;Kim Fabian Tiedemann;null;Salt;Medium;Dennis Schouten;01.11.2022 15:11;TMS;;;10;1;643;0;0;0;0;0;0;0;0;Backlog;2022-11-28T10:22:12.356+0100;;;;;;;;;;;;;;;;;;;;;;;;;;;;;;;;;;;;;;;;;;;;;;;;;;;;;;;;;;;;;;;;;;;;;;;;;;;;;;;;;;;;;;;;;;;;;;;;;;;;;;
HV-12168;Create BRE Customer eRENT IOT;User Story;IN CODE REVIEW;Diana Luft;null;BPS;Medium;Diana Luft;01.11.2022 14:27;RENT;;;9;3;0;0;0;0;0;0;0;0;0;In Clarification;2022-11-17T14:49:17.345+0100;In Progress;2022-11-17T14:49:20.000+0100;IN CODE REVIEW;2022-11-17T14:50:32.568+0100;;;;;;;;;;;;;;;;;;;;;;;;;;;;;;;;;;;;;;;;;;;;;;;;;;;;;;;;;;;;;;;;;;;;;;;;;;;;;;;;;;;;;;;;;;;;;;;;;;
HV-12167;Edit Talend API Customer Portal ;User Story;Testable;Sebastian Holzmann;Portal;DBA;Medium;Diana Luft;01.11.2022 13:43;TMS;;;11;3;0;41;1;0;0;0;0;0;0;Backlog;2022-11-01T14:22:01.769+0100;In Progress;2022-11-03T07:34:10.320+0100;Testable;2022-11-03T09:29:45.033+0100;;;;;;;;;;;;;;;;;;;;;;;;;;;;;;;;;;;;;;;;;;;;;;;;;;;;;;;;;;;;;;;;;;;;;;;;;;;;;;;;;;;;;;;;;;;;;;;;;;
HV-12166;Childtab security cannot be changed sometimes due to wrong child page id;Bug;Backlog;null;Security;Chili;Medium;Dennis Schouten;01.11.2022 09:15;TMS;;;7;1;1;0;0;0;0;0;0;0;0;Backlog;2022-11-01T11:00:03.914+0100;;;;;;;;;;;;;;;;;;;;;;;;;;;;;;;;;;;;;;;;;;;;;;;;;;;;;;;;;;;;;;;;;;;;;;;;;;;;;;;;;;;;;;;;;;;;;;;;;;;;;;
HV-12165;Regression test result 1.1;User Story;Test OK;Ulf Hensel;xServer;Salt;Medium;Dennis Schouten;31.10.2022 16:19;TMS;;;28;8;16;216;92;0;0;0;3;0;0;Backlog;2022-11-01T09:03:54.983+0100;In Progress;2022-11-10T09:57:07.425+0100;Testable;2022-11-10T11:39:31.483+0100;Test OK;2022-11-10T14:15:23.391+0100;In Clarification;2022-11-10T14:31:13.246+0100;In Progress;2022-11-10T14:31:23.793+0100;Testable;2022-11-14T09:46:21.696+0100;Test OK;2022-11-14T10:47:37.088+0100;;;;;;;;;;;;;;;;;;;;;;;;;;;;;;;;;;;;;;;;;;;;;;;;;;;;;;;;;;;;;;;;;;;;;;;;;;;;;;;;;;;;;;;;
HV-12164;Add Extend Price to Agreement validity and redirect to page 7475;User Story;Backlog;Bas Dijkgraaf;PACC Rail/Vessel;Salt;Medium;Sebastiaan Beuker;31.10.2022 11:39;TMS;;5.0;22;2;551;0;0;0;0;0;0;0;0;Backlog;2022-11-21T15:00:21.872+0100;Backlog;2022-11-23T11:21:54.338+0100;;;;;;;;;;;;;;;;;;;;;;;;;;;;;;;;;;;;;;;;;;;;;;;;;;;;;;;;;;;;;;;;;;;;;;;;;;;;;;;;;;;;;;;;;;;;;;;;;;;;
HV-12163;Screen Change Matrix Agreement;User Story;In Progress;Bas Dijkgraaf;PACC Rail/Vessel;Salt;Medium;Sebastiaan Beuker;31.10.2022 10:17;TMS;;20.0;16;3;553;2;0;0;0;0;0;0;0;Backlog;2022-11-21T15:00:21.828+0100;Backlog;2022-11-23T11:21:35.714+0100;In Progress;2022-11-23T13:23:47.330+0100;;;;;;;;;;;;;;;;;;;;;;;;;;;;;;;;;;;;;;;;;;;;;;;;;;;;;;;;;;;;;;;;;;;;;;;;;;;;;;;;;;;;;;;;;;;;;;;;;;
HV-12162;New parameter set for new M&G GUI/API;User Story;Backlog;null;xServer;Salt;Medium;Dennis Schouten;28.10.2022 15:27;TMS;;;8;1;0;0;0;0;0;0;0;0;0;Backlog;2022-10-28T15:53:07.360+0200;;;;;;;;;;;;;;;;;;;;;;;;;;;;;;;;;;;;;;;;;;;;;;;;;;;;;;;;;;;;;;;;;;;;;;;;;;;;;;;;;;;;;;;;;;;;;;;;;;;;;;
HV-12161;Security behind Business Rule Engine is hard-coded;Bug;Delivered OK;Tasar Sarcan;Security;Pepper;Medium;Dennis Schouten;28.10.2022 14:37;null;52-80-40;;25;9;66;28;21;0;0;53;116;337;18;Backlog;2022-10-28T16:59:31.977+0200;Backlog;2022-10-31T07:44:52.399+0100;In Progress;2022-11-01T11:55:46.790+0100;IN CODE REVIEW;2022-11-02T09:19:30.123+0100;Testable;2022-11-04T15:16:07.914+0100;Test OK;2022-11-09T11:16:39.132+0100;DELIVERED;2022-11-23T13:04:45.647+0100;DELIVERED INSTALLED;2022-11-24T07:49:58.833+0100;Delivered OK;2022-11-24T09:47:31.597+0100;;;;;;;;;;;;;;;;;;;;;;;;;;;;;;;;;;;;;;;;;;;;;;;;;;;;;;;;;;;;;;;;;;;;;;;;;;;;;;;;;;;;;;
HV-12159;Special Connection Type doesn't map to Correct SQL field;Bug;Test OK;Ahmed Tabook;Equipment;Pepper;Medium;Marcel Hoogenraad;28.10.2022 11:51;TMS;52-80-41;5.0;24;9;261;344;18;0;0;125;48;0;0;Backlog;2022-10-28T11:52:09.369+0200;Backlog;2022-11-08T07:58:04.671+0100;In Progress;2022-11-22T16:27:46.430+0100;IN CODE REVIEW;2022-11-23T10:43:02.926+0100;Testable;2022-11-28T16:11:27.745+0100;Test not OK;2022-11-30T15:57:20.269+0100;In Progress;2022-12-01T07:38:13.568+0100;Testable;2022-12-01T07:38:18.484+0100;Test OK;2022-12-01T08:46:23.339+0100;;;;;;;;;;;;;;;;;;;;;;;;;;;;;;;;;;;;;;;;;;;;;;;;;;;;;;;;;;;;;;;;;;;;;;;;;;;;;;;;;;;;;;
HV-12158;MARE - EDI Estimate Intray records Version check Improvements;Improvement;Test OK;Andre van Wingerden;MARE;Pepper;Medium;Berker Ahiska;28.10.2022 11:19;MARE;52-80-41;5.0;29;13;0;2;681;0;0;1;129;0;0;Backlog;2022-10-28T11:27:21.249+0200;Backlog;2022-10-28T11:53:47.171+0200;In Progress;2022-10-28T14:37:50.178+0200;IN CODE REVIEW;2022-11-25T15:02:19.610+0100;Testable;2022-11-25T16:04:54.940+0100;PAUSED;2022-11-28T07:22:46.433+0100;In Progress;2022-11-28T07:22:49.837+0100;Testable;2022-11-28T15:44:10.188+0100;Test not OK;2022-12-01T10:06:46.865+0100;PAUSED;2022-12-01T10:41:55.015+0100;In Progress;2022-12-01T10:41:57.861+0100;Testable;2022-12-01T11:23:24.061+0100;Test OK;2022-12-01T11:40:39.478+0100;;;;;;;;;;;;;;;;;;;;;;;;;;;;;;;;;;;;;;;;;;;;;;;;;;;;;;;;;;;;;;;;;;;;;;;;;;;;;;
HV-12148;IBA - Shipment 3417276 shows turnover in shipment financials overview;Bug;In Progress;Lennart Schultz;IBA;Ingwer;Medium;Marvin Dilg;27.10.2022 13:07;TMS;;;30;7;286;0;173;165;264;0;0;0;0;Backlog;2022-10-27T15:11:21.485+0200;In Progress;2022-10-28T10:50:16.099+0200;In Clarification;2022-10-28T10:50:29.133+0200;Backlog;2022-11-08T10:34:33.522+0100;In Progress;2022-11-08T10:34:40.745+0100;PAUSED;2022-11-15T15:42:02.684+0100;In Progress;2022-11-22T13:25:16.133+0100;;;;;;;;;;;;;;;;;;;;;;;;;;;;;;;;;;;;;;;;;;;;;;;;;;;;;;;;;;;;;;;;;;;;;;;;;;;;;;;;;;;;;;;;;;
HV-12147;Revenue out of Duration Orders;User Story;Backlog;Bas Dijkgraaf;Duration Orders;Salt;Medium;Robert Zwetsloot;26.10.2022 13:39;TMS;;;4;1;0;0;0;0;0;0;0;0;0;Backlog;2022-10-26T13:39:09.518+0200;;;;;;;;;;;;;;;;;;;;;;;;;;;;;;;;;;;;;;;;;;;;;;;;;;;;;;;;;;;;;;;;;;;;;;;;;;;;;;;;;;;;;;;;;;;;;;;;;;;;;;
HV-12146;Equipment Mass Update - Field Mapping 2;User Story;Closed;Marcel Hoogenraad;Equipment;Pepper;Medium;Marcel Hoogenraad;26.10.2022 09:01;TMS;;;5;2;0;0;0;0;0;0;0;0;0;On Hold;2022-11-29T17:03:04.954+0100;Closed;2022-11-29T17:03:33.324+0100;;;;;;;;;;;;;;;;;;;;;;;;;;;;;;;;;;;;;;;;;;;;;;;;;;;;;;;;;;;;;;;;;;;;;;;;;;;;;;;;;;;;;;;;;;;;;;;;;;;;
HV-12145;Equipment Mass Update - Field Mapping 1;User Story;Closed;Marcel Hoogenraad;Equipment;Pepper;Medium;Marcel Hoogenraad;26.10.2022 09:00;TMS;;;9;2;0;0;0;0;0;0;0;0;0;On Hold;2022-11-29T17:03:07.111+0100;Closed;2022-11-29T17:03:23.190+0100;;;;;;;;;;;;;;;;;;;;;;;;;;;;;;;;;;;;;;;;;;;;;;;;;;;;;;;;;;;;;;;;;;;;;;;;;;;;;;;;;;;;;;;;;;;;;;;;;;;;
HV-12144;Add maximum days in History to Housekeeping Job;Improvement;DELIVERED INSTALLED;Martin Steffen;Housekeeping;Salt;High;Robert Zwetsloot;24.10.2022 13:42;TMS;52-80-40;3.0;25;8;0;258;3;0;0;1;2;0;18;Backlog;2022-10-24T13:42:58.557+0200;In Progress;2022-11-04T07:37:57.547+0100;In Progress;2022-11-07T10:29:28.789+0100;IN CODE REVIEW;2022-11-07T13:43:41.613+0100;Testable;2022-11-07T14:58:01.832+0100;Not pretestable;2022-11-07T17:28:57.322+0100;DELIVERED;2022-11-23T13:04:44.536+0100;DELIVERED INSTALLED;2022-11-24T07:49:58.759+0100;;;;;;;;;;;;;;;;;;;;;;;;;;;;;;;;;;;;;;;;;;;;;;;;;;;;;;;;;;;;;;;;;;;;;;;;;;;;;;;;;;;;;;;;
HV-12143;Delivery Release 52-80-38;Build;Closed;Michael Voss;null;null;null;Michael Voss;24.10.2022 12:33;null;52-80-38;;33;10;0;0;48;0;0;0;0;0;18;In Progress;2022-10-24T12:33:43.595+0200;DELIVERED;2022-10-26T13:16:08.492+0200;DELIVERED INSTALLED;2022-10-27T07:53:32.649+0200;IN PRODUCTION;2022-11-14T20:20:54.801+0100;In Clarification;2022-11-15T08:35:58.966+0100;In Progress;2022-11-15T08:36:00.665+0100;DELIVERED;2022-11-15T08:36:02.004+0100;DELIVERED INSTALLED;2022-11-15T08:36:06.760+0100;IN PRODUCTION;2022-11-15T08:36:29.298+0100;Closed;2022-11-15T08:37:10.868+0100;;;;;;;;;;;;;;;;;;;;;;;;;;;;;;;;;;;;;;;;;;;;;;;;;;;;;;;;;;;;;;;;;;;;;;;;;;;;;;;;;;;;
HV-12142;New fields in Product Code/Ovw (4001/4023) Checkboxes Information Required and Mandatory;User Story;Backlog;Renee Clerx;Product;Pepper;Medium;Berker Ahiska;24.10.2022 11:28;TMS;;;15;1;870;0;0;0;0;0;0;0;0;Backlog;2022-11-29T16:49:17.214+0100;;;;;;;;;;;;;;;;;;;;;;;;;;;;;;;;;;;;;;;;;;;;;;;;;;;;;;;;;;;;;;;;;;;;;;;;;;;;;;;;;;;;;;;;;;;;;;;;;;;;;;
HV-12141;932 BP Density;User Story;Closed;Gerd Menge;null;eB;Medium;Thomas Weber;24.10.2022 10:41;TMS;;0.0;8;2;0;0;0;0;0;0;0;0;0;On Hold;2022-10-24T10:41:55.090+0200;Closed;2022-10-24T10:42:02.476+0200;;;;;;;;;;;;;;;;;;;;;;;;;;;;;;;;;;;;;;;;;;;;;;;;;;;;;;;;;;;;;;;;;;;;;;;;;;;;;;;;;;;;;;;;;;;;;;;;;;;;
HV-12140;932 BP UK density upload;User Story;Test OK;Gerd Menge;EDI;eB;Medium;Thomas Weber;24.10.2022 10:40;TMS;;5.0;12;5;1;261;170;0;0;0;312;0;0;Backlog;2022-10-24T12:13:57.049+0200;In Progress;2022-11-04T08:26:05.221+0100;IN CODE REVIEW;2022-11-11T11:05:36.333+0100;Testable;2022-11-11T11:08:38.190+0100;Test OK;2022-11-24T11:51:50.960+0100;;;;;;;;;;;;;;;;;;;;;;;;;;;;;;;;;;;;;;;;;;;;;;;;;;;;;;;;;;;;;;;;;;;;;;;;;;;;;;;;;;;;;;;;;;;;;;
HV-12139;905 Trisneo to FourKites;User Story;Closed;Gerd Menge;null;eB;Medium;Thomas Weber;24.10.2022 10:37;TMS;;2.0;6;2;0;0;0;0;0;0;0;0;0;On Hold;2022-10-24T10:39:11.784+0200;Closed;2022-10-24T10:39:20.806+0200;;;;;;;;;;;;;;;;;;;;;;;;;;;;;;;;;;;;;;;;;;;;;;;;;;;;;;;;;;;;;;;;;;;;;;;;;;;;;;;;;;;;;;;;;;;;;;;;;;;;
HV-12138;905 Trinseo Transport Visibility via FourKites;User Story;Closed;Gerd Menge;EDI;eB;Medium;Thomas Weber;24.10.2022 09:52;TMS;;;13;9;2;22;3;0;0;0;0;0;0;Backlog;2022-10-24T12:12:38.483+0200;In Progress;2022-10-25T10:55:01.392+0200;IN CODE REVIEW;2022-10-25T14:48:42.072+0200;Testable;2022-10-25T14:49:06.206+0200;DELIVERED;2022-10-25T14:49:09.470+0200;DELIVERED INSTALLED;2022-10-25T14:49:24.667+0200;Delivered OK;2022-10-25T14:49:53.840+0200;IN PRODUCTION;2022-10-26T08:49:34.681+0200;Closed;2022-10-26T08:50:27.876+0200;;;;;;;;;;;;;;;;;;;;;;;;;;;;;;;;;;;;;;;;;;;;;;;;;;;;;;;;;;;;;;;;;;;;;;;;;;;;;;;;;;;;;;
HV-12137;901 Olin/Bluecube to FourKites;User Story;Closed;Gerd Menge;null;eB;Medium;Thomas Weber;24.10.2022 09:51;TMS;;2.0;15;10;0;0;0;0;0;0;0;0;0;New;2022-10-24T10:38:16.313+0200;New;2022-10-25T14:50:40.210+0200;PAUSED;2022-10-25T14:50:45.450+0200;IN CODE REVIEW;2022-10-25T14:50:50.204+0200;Testable;2022-10-25T14:51:13.909+0200;DELIVERED;2022-10-25T14:51:28.314+0200;DELIVERED INSTALLED;2022-10-25T14:51:46.518+0200;Delivered OK;2022-10-25T14:51:55.792+0200;IN PRODUCTION;2022-10-26T08:49:11.623+0200;Closed;2022-10-26T08:53:50.840+0200;;;;;;;;;;;;;;;;;;;;;;;;;;;;;;;;;;;;;;;;;;;;;;;;;;;;;;;;;;;;;;;;;;;;;;;;;;;;;;;;;;;;
HV-12136;Shipment assignment in IMT Sensor and Position import does not consider UTC vs ECT;Improvement;Backlog;null;IMT Interface;Pepper;High;Robert Zwetsloot;21.10.2022 16:56;TMS;;;2;1;0;0;0;0;0;0;0;0;0;Backlog;2022-10-21T16:59:35.964+0200;;;;;;;;;;;;;;;;;;;;;;;;;;;;;;;;;;;;;;;;;;;;;;;;;;;;;;;;;;;;;;;;;;;;;;;;;;;;;;;;;;;;;;;;;;;;;;;;;;;;;;
HV-12135;Remover create VISTA_TO_IMT_TRANSPORT from IMT import;Improvement;Backlog;null;IMT Interface;Pepper;Medium;Robert Zwetsloot;21.10.2022 13:55;TMS;;;2;1;0;0;0;0;0;0;0;0;0;Backlog;2022-10-21T13:55:47.460+0200;;;;;;;;;;;;;;;;;;;;;;;;;;;;;;;;;;;;;;;;;;;;;;;;;;;;;;;;;;;;;;;;;;;;;;;;;;;;;;;;;;;;;;;;;;;;;;;;;;;;;;
HV-12134;Trip Import - Test Data Creator;User Story;Backlog;Perry van Steenveldt;TripImport;Curry;Medium;Rick Leijs;21.10.2022 13:18;TMS;;;24;2;669;0;0;0;0;0;0;0;0;New;2022-11-01T14:48:13.079+0100;Backlog;2022-11-18T09:41:40.238+0100;;;;;;;;;;;;;;;;;;;;;;;;;;;;;;;;;;;;;;;;;;;;;;;;;;;;;;;;;;;;;;;;;;;;;;;;;;;;;;;;;;;;;;;;;;;;;;;;;;;;
HV-12132;Write off header doesn't work correctly with Order Legal Entity;Bug;Delivered OK;Sreesubha Vijayan;IBA;Ingwer;High;Oliver Manner-Romberg;21.10.2022 10:51;TMS;52-80-40;5.0;48;12;2;74;214;0;28;0;113;338;18;Backlog;2022-10-21T13:06:28.525+0200;Backlog;2022-10-21T13:06:50.091+0200;In Progress;2022-10-24T16:04:49.989+0200;In Progress;2022-10-25T13:18:16.137+0200;PAUSED;2022-10-26T10:59:18.051+0200;In Clarification;2022-10-26T11:45:11.736+0200;In Progress;2022-10-27T16:31:38.466+0200;Testable;2022-11-04T17:29:51.079+0100;Test OK;2022-11-09T11:03:30.193+0100;DELIVERED;2022-11-23T13:04:45.697+0100;DELIVERED INSTALLED;2022-11-24T07:49:58.889+0100;Delivered OK;2022-12-02T11:22:49.353+0100;;;;;;;;;;;;;;;;;;;;;;;;;;;;;;;;;;;;;;;;;;;;;;;;;;;;;;;;;;;;;;;;;;;;;;;;;;;;;;;;
HV-12131;Create BRE for create_update Equipment Services;User Story;Testable;Diana Luft;Portal;BPS;Medium;Diana Luft;20.10.2022 16:33;TMS;;;21;5;286;382;0;0;0;144;0;0;0;Backlog;2022-11-01T14:18:29.268+0100;In Clarification;2022-11-17T12:49:32.345+0100;In Progress;2022-11-17T12:49:37.254+0100;IN CODE REVIEW;2022-11-17T13:40:38.156+0100;Testable;2022-11-23T14:31:49.011+0100;;;;;;;;;;;;;;;;;;;;;;;;;;;;;;;;;;;;;;;;;;;;;;;;;;;;;;;;;;;;;;;;;;;;;;;;;;;;;;;;;;;;;;;;;;;;;;
HV-12130;Create Talend API Equipment Services;User Story;Testable;Sebastian Holzmann;Portal;DBA;Medium;Diana Luft;20.10.2022 16:30;TMS;;;13;3;286;211;438;0;0;0;0;0;0;Backlog;2022-11-01T14:18:29.205+0100;In Progress;2022-11-10T10:04:17.761+0100;Testable;2022-11-28T16:19:25.090+0100;;;;;;;;;;;;;;;;;;;;;;;;;;;;;;;;;;;;;;;;;;;;;;;;;;;;;;;;;;;;;;;;;;;;;;;;;;;;;;;;;;;;;;;;;;;;;;;;;;
HV-12129;Create Select Statement API Equipment Services ;User Story;Test not OK;Perry van Steenveldt;Portal;BPS;Medium;Diana Luft;20.10.2022 16:26;eRENT;;;28;11;286;0;143;0;0;0;341;242;0;Backlog;2022-11-01T14:18:29.141+0100;In Progress;2022-11-01T14:20:13.690+0100;IN CODE REVIEW;2022-11-07T13:39:46.229+0100;Testable;2022-11-07T14:25:38.427+0100;Testable;2022-11-08T08:23:29.154+0100;Test OK;2022-11-22T13:26:27.554+0100;In Clarification;2022-12-02T16:06:55.921+0100;In Progress;2022-12-02T16:07:03.312+0100;IN CODE REVIEW;2022-12-02T16:07:21.498+0100;Testable;2022-12-02T16:14:54.844+0100;Test not OK;2022-12-02T16:15:23.246+0100;;;;;;;;;;;;;;;;;;;;;;;;;;;;;;;;;;;;;;;;;;;;;;;;;;;;;;;;;;;;;;;;;;;;;;;;;;;;;;;;;;
HV-12128;Tab not working correctly in PACC calculator;Bug;Backlog;null;PACC Trucking;Salt;Medium;Mark Pieterse;20.10.2022 15:25;TMS;;;5;2;24;0;0;0;0;0;0;0;0;New;2022-10-21T09:24:13.392+0200;Backlog;2022-10-21T15:43:49.189+0200;;;;;;;;;;;;;;;;;;;;;;;;;;;;;;;;;;;;;;;;;;;;;;;;;;;;;;;;;;;;;;;;;;;;;;;;;;;;;;;;;;;;;;;;;;;;;;;;;;;;
HV-12126;Split Table MU_MESG;Bug;In Progress;Alberto Monje Menas;D&M;Chili;High;Arne Hattendorf;20.10.2022 10:54;null;;10.0;20;3;0;0;0;0;0;0;0;0;0;New;2022-10-26T10:56:33.351+0200;In Clarification;2022-10-26T10:57:09.033+0200;In Progress;2022-10-26T10:57:19.587+0200;;;;;;;;;;;;;;;;;;;;;;;;;;;;;;;;;;;;;;;;;;;;;;;;;;;;;;;;;;;;;;;;;;;;;;;;;;;;;;;;;;;;;;;;;;;;;;;;;;
HV-12125;MARE - Change text in email approval Vista MARE;Improvement;Closed;Berker Ahiska;MARE;Pepper;Medium;Berker Ahiska;20.10.2022 10:11;MARE;;;13;5;1;0;0;0;0;0;0;0;0;Backlog;2022-10-20T11:34:38.381+0200;In Clarification;2022-10-20T11:44:17.807+0200;In Clarification;2022-10-20T12:44:23.692+0200;On Hold;2022-10-20T12:44:25.985+0200;Closed;2022-10-20T12:44:34.614+0200;;;;;;;;;;;;;;;;;;;;;;;;;;;;;;;;;;;;;;;;;;;;;;;;;;;;;;;;;;;;;;;;;;;;;;;;;;;;;;;;;;;;;;;;;;;;;;
HV-12124;Make Project Owner editable;User Story;Backlog;Renee Clerx;RESERVATION;Pepper;Medium;Patrick Schwind;19.10.2022 10:37;RESERVATION;;5.0;19;3;984;0;0;0;0;0;0;0;0;New;2022-10-19T10:40:13.171+0200;Backlog;2022-10-24T10:43:22.996+0200;Backlog;2022-11-29T09:55:57.971+0100;;;;;;;;;;;;;;;;;;;;;;;;;;;;;;;;;;;;;;;;;;;;;;;;;;;;;;;;;;;;;;;;;;;;;;;;;;;;;;;;;;;;;;;;;;;;;;;;;;
HV-12123;BRE message batch job is running slow ;Bug;Closed;Arne Hattendorf;Business Rule Engine;Salt;High;Matthias Rom;18.10.2022 16:15;null;;;18;6;0;18;6;0;484;0;0;0;0;Backlog;2022-10-18T16:15:57.522+0200;In Progress;2022-10-19T11:06:37.629+0200;In Clarification;2022-10-19T17:06:54.263+0200;In Clarification;2022-10-20T08:23:42.300+0200;On Hold;2022-11-09T12:02:21.130+0100;Closed;2022-11-09T12:02:26.168+0100;;;;;;;;;;;;;;;;;;;;;;;;;;;;;;;;;;;;;;;;;;;;;;;;;;;;;;;;;;;;;;;;;;;;;;;;;;;;;;;;;;;;;;;;;;;;
HV-12122;Improve Housekeeping for Matchboard, Planboard, Overview;Bug;Closed;Arne Hattendorf;D&M technical;Chili;SHOWSTOPPER TST;Arne Hattendorf;18.10.2022 11:28;null;52-80-38a;1.0;49;23;341;18;2;0;0;0;2;3;19;Backlog;2022-10-18T13:29:57.284+0200;In Clarification;2022-10-18T13:38:23.493+0200;In Progress;2022-10-18T13:38:51.233+0200;Testable;2022-10-18T15:33:00.224+0200;In Clarification;2022-10-18T17:53:19.859+0200;In Progress;2022-10-18T17:53:23.675+0200;Not pretestable;2022-10-18T17:53:56.223+0200;DELIVERED;2022-10-26T13:16:08.820+0200;DELIVERED INSTALLED;2022-10-27T07:53:32.760+0200;Delivered not OK;2022-11-01T15:07:58.603+0100;Delivered not OK;2022-11-01T15:11:47.554+0100;Backlog;2022-11-01T15:33:18.990+0100;In Progress;2022-11-02T10:30:57.188+0100;Not pretestable;2022-11-02T12:20:15.028+0100;In Clarification;2022-11-03T08:54:46.340+0100;In Progress;2022-11-03T08:55:05.331+0100;Testable;2022-11-03T08:55:55.923+0100;Test OK;2022-11-03T09:08:35.571+0100;DELIVERED;2022-11-03T12:23:36.144+0100;DELIVERED INSTALLED;2022-11-03T14:02:27.150+0100;Delivered OK;2022-11-04T10:04:08.446+0100;IN PRODUCTION;2022-11-14T20:20:55.026+0100;Closed;2022-11-15T08:37:10.980+0100;;;;;;;;;;;;;;;;;;;;;;;;;;;;;;;;;;;;;;;;;;;;;;;;;;;;;;;;;;
HV-12121;Delivery Release 52-80-37a;Build;Closed;Michael Voss;null;null;null;Michael Voss;17.10.2022 13:26;null;52-80-37a;;13;5;0;0;165;0;0;0;0;0;3;In Progress;2022-10-17T13:26:54.313+0200;DELIVERED;2022-10-24T11:06:54.664+0200;DELIVERED INSTALLED;2022-10-24T14:16:03.038+0200;IN PRODUCTION;2022-10-29T11:42:54.214+0200;Closed;2022-11-15T08:28:19.085+0100;;;;;;;;;;;;;;;;;;;;;;;;;;;;;;;;;;;;;;;;;;;;;;;;;;;;;;;;;;;;;;;;;;;;;;;;;;;;;;;;;;;;;;;;;;;;;;
HV-12120;Delivery Release 52-80-36c;Build;Closed;Michael Voss;null;null;null;Michael Voss;17.10.2022 09:43;null;52-80-36c;;13;5;0;0;3;0;0;0;0;0;0;In Progress;2022-10-17T09:43:39.393+0200;DELIVERED;2022-10-17T13:29:21.384+0200;DELIVERED INSTALLED;2022-10-17T13:49:01.850+0200;IN PRODUCTION;2022-10-17T14:20:19.234+0200;Closed;2022-11-15T08:27:41.738+0100;;;;;;;;;;;;;;;;;;;;;;;;;;;;;;;;;;;;;;;;;;;;;;;;;;;;;;;;;;;;;;;;;;;;;;;;;;;;;;;;;;;;;;;;;;;;;;
HV-12119;Error in Board Computer message due to missing field;Bug;Closed;Georgios Antoniadis;BOARDCOMPUTER;null;Immediate;Rick Leijs;17.10.2022 09:13;TMS;52-80-37a;;23;9;0;1;0;0;0;0;1;1;0;Backlog;2022-10-17T09:16:13.519+0200;In Progress;2022-10-17T10:17:24.856+0200;Testable;2022-10-17T10:18:06.729+0200;Test OK;2022-10-17T12:13:52.444+0200;DELIVERED;2022-10-17T13:29:21.521+0200;DELIVERED INSTALLED;2022-10-17T13:49:01.926+0200;Delivered OK;2022-10-17T13:59:01.544+0200;IN PRODUCTION;2022-10-17T14:20:19.330+0200;Closed;2022-11-15T08:27:41.750+0100;;;;;;;;;;;;;;;;;;;;;;;;;;;;;;;;;;;;;;;;;;;;;;;;;;;;;;;;;;;;;;;;;;;;;;;;;;;;;;;;;;;;;;
HV-12118;MARE - Rogue Estimate disturbs IR 8700;Bug;Backlog;Tasar Sarcan;MARE;Pepper;High;Berker Ahiska;14.10.2022 17:45;MARE;;;15;2;477;0;0;0;0;0;0;0;0;Backlog;2022-10-17T16:06:20.430+0200;Backlog;2022-11-03T14:18:20.549+0100;;;;;;;;;;;;;;;;;;;;;;;;;;;;;;;;;;;;;;;;;;;;;;;;;;;;;;;;;;;;;;;;;;;;;;;;;;;;;;;;;;;;;;;;;;;;;;;;;;;;
HV-12116;Test results HV-10593 v1.1;User Story;Test OK;Ulf Hensel;xServer;Salt;Medium;Dennis Schouten;14.10.2022 10:33;TMS;;;15;4;5;642;0;0;0;0;2;0;0;Backlog;2022-10-14T16:04:55.152+0200;In Progress;2022-11-10T09:49:40.870+0100;Testable;2022-11-10T09:50:20.928+0100;Test OK;2022-11-10T12:26:36.244+0100;;;;;;;;;;;;;;;;;;;;;;;;;;;;;;;;;;;;;;;;;;;;;;;;;;;;;;;;;;;;;;;;;;;;;;;;;;;;;;;;;;;;;;;;;;;;;;;;
HV-12115;Reservation - Start date of a new TKC reservation is not set to current date;Bug;IN CODE REVIEW;Renee Clerx;RESERVATION;Pepper;Medium;Patrick Schwind;14.10.2022 10:32;null;;;28;7;675;428;28;0;27;0;0;0;0;Backlog;2022-10-17T10:09:25.052+0200;Backlog;2022-10-28T11:19:51.351+0200;In Progress;2022-11-09T10:14:07.757+0100;In Clarification;2022-11-10T10:01:31.152+0100;Backlog;2022-11-11T13:10:19.025+0100;In Progress;2022-11-29T09:46:49.674+0100;IN CODE REVIEW;2022-11-29T15:45:47.012+0100;;;;;;;;;;;;;;;;;;;;;;;;;;;;;;;;;;;;;;;;;;;;;;;;;;;;;;;;;;;;;;;;;;;;;;;;;;;;;;;;;;;;;;;;;;
HV-12114;Set Estimate to Ready check error between Estimate Date and Eq Settlement ;Bug;Delivered OK;Tasar Sarcan;MARE;Pepper;Medium;Berker Ahiska;13.10.2022 15:59;MARE;52-80-40;;21;9;503;140;0;0;0;47;125;165;18;Backlog;2022-10-13T18:05:45.838+0200;Backlog;2022-11-03T14:18:33.974+0100;In Progress;2022-11-09T11:01:54.313+0100;IN CODE REVIEW;2022-11-09T11:03:01.372+0100;Testable;2022-11-11T10:36:28.201+0100;Test OK;2022-11-16T15:42:22.426+0100;DELIVERED;2022-11-23T13:04:45.752+0100;DELIVERED INSTALLED;2022-11-24T07:49:58.951+0100;Delivered OK;2022-11-28T11:15:07.766+0100;;;;;;;;;;;;;;;;;;;;;;;;;;;;;;;;;;;;;;;;;;;;;;;;;;;;;;;;;;;;;;;;;;;;;;;;;;;;;;;;;;;;;;
HV-12113;Purchase Order LE Determination Improvement;Improvement;Backlog;null;Purchase  Order;Salt;High;Berker Ahiska;13.10.2022 14:54;TMS;;;11;1;3;0;0;0;0;0;0;0;0;Backlog;2022-10-13T18:06:07.678+0200;;;;;;;;;;;;;;;;;;;;;;;;;;;;;;;;;;;;;;;;;;;;;;;;;;;;;;;;;;;;;;;;;;;;;;;;;;;;;;;;;;;;;;;;;;;;;;;;;;;;;;
HV-12112;Original Product Code missing the 00 in front of the code;Bug;Backlog;Ahmed Tabook;Product;Pepper;High;Mark Pieterse;13.10.2022 11:31;TMS;;5.0;19;2;2;0;0;0;0;0;0;0;0;New;2022-10-13T12:16:01.052+0200;Backlog;2022-10-13T13:32:17.204+0200;;;;;;;;;;;;;;;;;;;;;;;;;;;;;;;;;;;;;;;;;;;;;;;;;;;;;;;;;;;;;;;;;;;;;;;;;;;;;;;;;;;;;;;;;;;;;;;;;;;;
HV-12111;Bulk test results DEPL;User Story;Test OK;Ulf Hensel;xServer;Salt;Medium;Dennis Schouten;13.10.2022 11:00;TMS;;;25;7;0;26;427;0;0;0;4;0;0;Backlog;2022-10-13T11:47:52.926+0200;In Progress;2022-10-14T14:46:35.457+0200;Testable;2022-10-14T14:46:54.621+0200;Test not OK;2022-10-14T15:17:00.405+0200;In Progress;2022-10-14T15:18:44.237+0200;Testable;2022-11-01T09:44:18.129+0100;Test OK;2022-11-01T14:06:04.618+0100;;;;;;;;;;;;;;;;;;;;;;;;;;;;;;;;;;;;;;;;;;;;;;;;;;;;;;;;;;;;;;;;;;;;;;;;;;;;;;;;;;;;;;;;;;
HV-12110;Test results HV-10614 v1.1;User Story;Test OK;Ulf Hensel;xServer;Salt;Medium;Dennis Schouten;13.10.2022 10:06;TMS;;;30;4;1;115;0;0;0;0;31;0;0;Backlog;2022-10-13T11:48:50.403+0200;In Progress;2022-10-18T06:54:53.938+0200;Testable;2022-10-18T06:55:17.290+0200;Test OK;2022-10-19T14:09:44.272+0200;;;;;;;;;;;;;;;;;;;;;;;;;;;;;;;;;;;;;;;;;;;;;;;;;;;;;;;;;;;;;;;;;;;;;;;;;;;;;;;;;;;;;;;;;;;;;;;;
HV-12109;Equipment History - Performance;User Story;Backlog;Arne Hattendorf;Equipment;Pepper;Medium;Marcel Hoogenraad;13.10.2022 08:37;FMS;;2.0;18;1;311;0;0;0;0;0;0;0;0;Backlog;2022-10-26T08:19:32.707+0200;;;;;;;;;;;;;;;;;;;;;;;;;;;;;;;;;;;;;;;;;;;;;;;;;;;;;;;;;;;;;;;;;;;;;;;;;;;;;;;;;;;;;;;;;;;;;;;;;;;;;;
HV-12108;Edit Customer Portal API;User Story;Test OK;Perry van Steenveldt;Portal;BPS;Medium;Diana Luft;12.10.2022 14:38;TMS;;;24;6;480;0;143;0;0;0;359;0;0;Backlog;2022-11-01T14:22:01.819+0100;In Progress;2022-11-01T14:22:13.569+0100;IN CODE REVIEW;2022-11-07T13:36:49.041+0100;Testable;2022-11-07T14:23:03.965+0100;Testable;2022-11-07T14:23:45.116+0100;Test OK;2022-11-22T13:25:40.481+0100;;;;;;;;;;;;;;;;;;;;;;;;;;;;;;;;;;;;;;;;;;;;;;;;;;;;;;;;;;;;;;;;;;;;;;;;;;;;;;;;;;;;;;;;;;;;
HV-12107;Expand IMT Last Positions & Sensors  overview;Improvement;Closed;Tasar Sarcan;IMT Interface;Pepper;High;Robert Zwetsloot;12.10.2022 13:10;TMS;52-80-37a;;24;12;0;0;51;0;0;0;0;5;0;Backlog;2022-10-12T13:11:22.951+0200;Backlog;2022-10-12T13:12:47.748+0200;In Progress;2022-10-12T13:30:29.636+0200;IN CODE REVIEW;2022-10-14T16:31:46.036+0200;Testable;2022-10-14T16:36:21.885+0200;Test OK;2022-10-14T16:44:04.822+0200;Test OK;2022-10-17T07:46:20.419+0200;DELIVERED;2022-10-17T13:29:21.401+0200;DELIVERED INSTALLED;2022-10-17T13:49:01.868+0200;Delivered OK;2022-10-17T14:03:51.907+0200;IN PRODUCTION;2022-10-17T14:20:19.254+0200;Closed;2022-11-15T08:27:41.819+0100;;;;;;;;;;;;;;;;;;;;;;;;;;;;;;;;;;;;;;;;;;;;;;;;;;;;;;;;;;;;;;;;;;;;;;;;;;;;;;;;
HV-12106;Delivery Release 52-80-36b;Build;Closed;Michael Voss;null;null;null;Michael Voss;12.10.2022 09:35;null;52-80-36b;;10;5;0;0;3;0;0;0;0;0;19;In Progress;2022-10-12T09:35:43.012+0200;DELIVERED;2022-10-12T13:08:59.843+0200;DELIVERED INSTALLED;2022-10-13T08:32:38.960+0200;IN PRODUCTION;2022-11-15T08:26:48.993+0100;Closed;2022-11-15T08:26:52.807+0100;;;;;;;;;;;;;;;;;;;;;;;;;;;;;;;;;;;;;;;;;;;;;;;;;;;;;;;;;;;;;;;;;;;;;;;;;;;;;;;;;;;;;;;;;;;;;;
HV-12105;Drag&Drop Document Types visible even the Active falg is N in 10203 DMS_DOC_PER_SCR;Bug;Backlog;Georgios Antoniadis;Drag&Drop;Salt;High;Matthias Rom;12.10.2022 08:53;TMS;;;9;2;0;0;0;0;0;0;0;0;0;Backlog;2022-10-12T08:55:20.699+0200;Backlog;2022-10-12T08:56:15.571+0200;;;;;;;;;;;;;;;;;;;;;;;;;;;;;;;;;;;;;;;;;;;;;;;;;;;;;;;;;;;;;;;;;;;;;;;;;;;;;;;;;;;;;;;;;;;;;;;;;;;;
HV-12104;Planboard causes high CPU Load in Database;Incident;Backlog;Georgios Antoniadis;D&M technical;Chili;Medium;Ali Ceyhan;11.10.2022 16:58;null;;;26;0;0;0;0;0;0;0;0;0;0;;;;;;;;;;;;;;;;;;;;;;;;;;;;;;;;;;;;;;;;;;;;;;;;;;;;;;;;;;;;;;;;;;;;;;;;;;;;;;;;;;;;;;;;;;;;;;;;;;;;;;;;
HV-12103;xServer Basic and Detailed toll update Turkey;Incident;Closed;Kim Fabian Tiedemann;xServer;Salt;Medium;Dennis Schouten;11.10.2022 16:32;null;;;14;9;0;0;0;0;0;0;8;15;0;In Progress;2022-10-13T07:44:42.342+0200;Testable;2022-10-13T07:45:31.715+0200;Test not OK;2022-10-13T15:47:55.946+0200;In Clarification;2022-10-13T15:48:12.529+0200;In Progress;2022-10-13T15:48:23.145+0200;Testable;2022-10-13T15:49:54.110+0200;Test OK;2022-10-13T15:50:13.658+0200;DELIVERED;2022-10-14T07:35:48.627+0200;Closed;2022-10-14T07:35:53.462+0200;;;;;;;;;;;;;;;;;;;;;;;;;;;;;;;;;;;;;;;;;;;;;;;;;;;;;;;;;;;;;;;;;;;;;;;;;;;;;;;;;;;;;;
HV-12102;EQUIPMENT >> Equipment Search(3988) Remove e-Rent rules for Field Authorization;Improvement;IN CODE REVIEW;Ahmed Tabook;Equipment;Pepper;Medium;Berker Ahiska;11.10.2022 11:41;TMS;;5.0;30;4;1;913;94;0;0;0;0;0;0;Backlog;2022-10-11T12:54:49.331+0200;Backlog;2022-10-11T12:55:02.835+0200;In Progress;2022-11-18T13:53:09.398+0100;IN CODE REVIEW;2022-11-22T11:56:17.203+0100;;;;;;;;;;;;;;;;;;;;;;;;;;;;;;;;;;;;;;;;;;;;;;;;;;;;;;;;;;;;;;;;;;;;;;;;;;;;;;;;;;;;;;;;;;;;;;;;
HV-12101;MARE - EDI Estimate Intray - Conversion & Validation Improvements;Improvement;IN PRODUCTION;Andre van Wingerden;MARE;Pepper;High;Berker Ahiska;10.10.2022 16:34;MARE;52-80-39;10.0;25;14;160;5;75;0;0;21;163;294;40;Backlog;2022-10-10T16:50:56.486+0200;Backlog;2022-10-17T08:45:46.776+0200;In Progress;2022-10-17T13:59:01.612+0200;IN CODE REVIEW;2022-10-20T17:01:35.468+0200;Testable;2022-10-21T14:39:23.438+0200;Test not OK;2022-10-28T10:13:24.379+0200;PAUSED;2022-10-28T11:08:00.839+0200;In Progress;2022-10-28T11:08:03.612+0200;Testable;2022-10-28T11:08:07.857+0200;Test OK;2022-10-28T11:51:01.096+0200;DELIVERED;2022-11-09T17:42:57.209+0100;DELIVERED INSTALLED;2022-11-11T10:36:21.124+0100;Delivered OK;2022-11-22T13:31:26.940+0100;IN PRODUCTION;2022-11-26T11:14:26.576+0100;;;;;;;;;;;;;;;;;;;;;;;;;;;;;;;;;;;;;;;;;;;;;;;;;;;;;;;;;;;;;;;;;;;;;;;;;;;;
HV-12100;Customer Portal - API Equipment Services;Epic;In Progress;Diana Luft;Portal;DBA;Medium;Johanna Klassen;10.10.2022 16:34;TMS;;;20;8;526;0;0;0;0;0;0;0;0;New;2022-10-10T16:34:09.996+0200;New;2022-10-13T16:44:08.523+0200;In Analysis;2022-11-01T14:15:45.253+0100;In Review;2022-11-01T14:16:45.699+0100;Reviewed;2022-11-01T14:18:06.215+0100;Approved;2022-11-01T14:18:09.791+0100;Backlog;2022-11-01T14:18:29.121+0100;In Progress;2022-11-01T14:20:13.702+0100;;;;;;;;;;;;;;;;;;;;;;;;;;;;;;;;;;;;;;;;;;;;;;;;;;;;;;;;;;;;;;;;;;;;;;;;;;;;;;;;;;;;;;;;
HV-12099;eRENT Switch agreement is not able to handle every Agreement Validity Date;Bug;IN PRODUCTION;Andre van Wingerden;eRENT;Pepper;High;Patrick Schwind;10.10.2022 15:06;eRENT;52-80-39;;22;11;0;577;22;0;0;0;65;56;40;Backlog;2022-10-10T16:05:16.021+0200;In Progress;2022-11-03T16:48:04.791+0100;In Progress;2022-11-03T16:48:08.845+0100;In Progress;2022-11-03T16:56:32.568+0100;IN CODE REVIEW;2022-11-04T15:04:14.820+0100;Testable;2022-11-04T15:54:48.004+0100;Test OK;2022-11-07T09:42:53.465+0100;DELIVERED;2022-11-09T17:43:00.039+0100;DELIVERED INSTALLED;2022-11-11T10:36:21.379+0100;Delivered OK;2022-11-14T11:17:04.238+0100;IN PRODUCTION;2022-11-26T11:14:26.848+0100;;;;;;;;;;;;;;;;;;;;;;;;;;;;;;;;;;;;;;;;;;;;;;;;;;;;;;;;;;;;;;;;;;;;;;;;;;;;;;;;;;
HV-12098;MARE - Recall Estimate/Review All causes missing Cost Lines;Bug;Test OK;Tasar Sarcan;MARE;Pepper;High;Berker Ahiska;10.10.2022 14:56;MARE;52-80-41;;24;6;576;145;0;0;0;42;267;0;0;Backlog;2022-10-10T16:55:55.858+0200;Backlog;2022-11-03T14:18:26.668+0100;In Progress;2022-11-09T16:16:44.701+0100;IN CODE REVIEW;2022-11-09T16:16:47.757+0100;Testable;2022-11-11T10:36:02.984+0100;Test OK;2022-11-22T13:54:24.381+0100;;;;;;;;;;;;;;;;;;;;;;;;;;;;;;;;;;;;;;;;;;;;;;;;;;;;;;;;;;;;;;;;;;;;;;;;;;;;;;;;;;;;;;;;;;;;
HV-12097;MARE - Estimate Lines Version vs Estimate Version Mismatch;Bug;In Progress;Tasar Sarcan;MARE;Pepper;High;Berker Ahiska;10.10.2022 13:33;MARE;;;16;3;577;119;0;0;0;0;0;0;0;Backlog;2022-10-10T15:14:20.412+0200;Backlog;2022-11-03T14:18:08.488+0100;In Progress;2022-11-08T14:05:29.159+0100;;;;;;;;;;;;;;;;;;;;;;;;;;;;;;;;;;;;;;;;;;;;;;;;;;;;;;;;;;;;;;;;;;;;;;;;;;;;;;;;;;;;;;;;;;;;;;;;;;
HV-12096;Customer Portal - Enhancement API Customer ;Epic;In Progress;Diana Luft;Portal;DBA;Medium;Bjoern Smidt;10.10.2022 13:15;TMS;;;20;7;530;0;0;0;0;0;0;0;0;New;2022-10-10T13:15:29.123+0200;In Analysis;2022-11-01T14:21:26.131+0100;In Review;2022-11-01T14:21:40.700+0100;Reviewed;2022-11-01T14:21:55.557+0100;Approved;2022-11-01T14:21:58.400+0100;Backlog;2022-11-01T14:22:01.752+0100;In Progress;2022-11-01T14:22:13.580+0100;;;;;;;;;;;;;;;;;;;;;;;;;;;;;;;;;;;;;;;;;;;;;;;;;;;;;;;;;;;;;;;;;;;;;;;;;;;;;;;;;;;;;;;;;;
HV-12095;Delivery Release 52-80-37;Build;Closed;Michael Voss;null;null;null;Michael Voss;10.10.2022 11:24;null;52-80-37;;36;5;0;0;56;0;0;0;0;0;17;In Progress;2022-10-10T11:24:58.620+0200;DELIVERED;2022-10-12T19:37:03.812+0200;DELIVERED INSTALLED;2022-10-13T13:09:18.556+0200;IN PRODUCTION;2022-10-29T11:42:39.433+0200;Closed;2022-11-15T08:27:13.486+0100;;;;;;;;;;;;;;;;;;;;;;;;;;;;;;;;;;;;;;;;;;;;;;;;;;;;;;;;;;;;;;;;;;;;;;;;;;;;;;;;;;;;;;;;;;;;;;
HV-12094;RENT: Optimize SQL-Statement for IBC Overview;Bug;Closed;Arne Hattendorf;Multilog Rental;null;High;Rainer Kohnert;10.10.2022 09:33;RENT;52-80-37;1.0;27;9;0;8;18;0;0;0;0;31;17;Backlog;2022-10-10T09:34:08.920+0200;In Progress;2022-10-10T17:35:19.209+0200;Testable;2022-10-11T12:08:09.725+0200;Test OK;2022-10-11T12:28:52.320+0200;DELIVERED;2022-10-12T19:37:05.091+0200;DELIVERED INSTALLED;2022-10-13T13:09:19.572+0200;Delivered OK;2022-10-14T13:11:32.688+0200;IN PRODUCTION;2022-10-29T11:42:40.521+0200;Closed;2022-11-15T08:27:13.910+0100;;;;;;;;;;;;;;;;;;;;;;;;;;;;;;;;;;;;;;;;;;;;;;;;;;;;;;;;;;;;;;;;;;;;;;;;;;;;;;;;;;;;;;
HV-12093;CLONE - Adjust Attachments child under screens with DMS functionality;User Story;In Progress;Martin Steffen;Drag&Drop;Salt;Medium;Robert Zwetsloot;07.10.2022 16:07;TMS;;3.0;25;2;0;1414;0;0;0;0;0;0;0;Backlog;2022-10-07T16:11:42.175+0200;In Progress;2022-12-05T13:33:18.279+0100;;;;;;;;;;;;;;;;;;;;;;;;;;;;;;;;;;;;;;;;;;;;;;;;;;;;;;;;;;;;;;;;;;;;;;;;;;;;;;;;;;;;;;;;;;;;;;;;;;;;
HV-12084;Delivery Release 52-80-36a;Build;Closed;Michael Voss;null;null;null;Michael Voss;07.10.2022 14:56;null;52-80-36a;;17;5;0;0;67;0;0;0;0;0;0;In Progress;2022-10-07T14:57:21.545+0200;DELIVERED;2022-10-10T10:23:25.597+0200;DELIVERED INSTALLED;2022-10-10T10:23:28.698+0200;IN PRODUCTION;2022-10-16T12:07:13.113+0200;Closed;2022-11-15T08:25:51.305+0100;;;;;;;;;;;;;;;;;;;;;;;;;;;;;;;;;;;;;;;;;;;;;;;;;;;;;;;;;;;;;;;;;;;;;;;;;;;;;;;;;;;;;;;;;;;;;;
HV-12082;transmission problems Fleetvisor - Vista | deliver Hint;Bug;Closed;Thomas Deter;Performance;Muskat;High;Thomas Deter;07.10.2022 14:20;TMS;52-80-37;;17;10;0;0;0;0;0;0;0;0;17;New;2022-10-07T14:21:39.328+0200;In Clarification;2022-10-07T14:22:23.014+0200;In Progress;2022-10-07T14:22:33.652+0200;IN CODE REVIEW;2022-10-07T14:56:47.854+0200;Not pretestable;2022-10-07T14:58:53.757+0200;DELIVERED;2022-10-12T19:37:05.344+0200;DELIVERED INSTALLED;2022-10-13T13:09:19.854+0200;Delivered OK;2022-10-20T13:33:16.966+0200;IN PRODUCTION;2022-10-29T11:42:40.821+0200;Closed;2022-11-15T08:27:14.122+0100;;;;;;;;;;;;;;;;;;;;;;;;;;;;;;;;;;;;;;;;;;;;;;;;;;;;;;;;;;;;;;;;;;;;;;;;;;;;;;;;;;;;
HV-12081;UK BP density upload;Epic;Test OK;Thomas Weber;EDI;eB;Medium;Peter Reischl;07.10.2022 13:03;TMS;;;15;5;405;262;483;0;0;0;0;0;0;On Hold;2022-10-14T15:29:07.015+0200;New;2022-10-14T15:29:09.787+0200;Backlog;2022-10-24T10:40:19.229+0200;In Progress;2022-11-04T08:26:05.234+0100;Test OK;2022-11-24T11:51:50.974+0100;;;;;;;;;;;;;;;;;;;;;;;;;;;;;;;;;;;;;;;;;;;;;;;;;;;;;;;;;;;;;;;;;;;;;;;;;;;;;;;;;;;;;;;;;;;;;;
HV-12080;Improve speed lasts postions view;Improvement;Closed;Tasar Sarcan;EDI;Pepper;High;Robert Zwetsloot;06.10.2022 16:44;TMS;;;16;11;0;0;1;0;0;0;0;72;0;Backlog;2022-10-06T16:46:14.445+0200;In Progress;2022-10-06T16:48:32.491+0200;In Progress;2022-10-07T08:05:46.646+0200;IN CODE REVIEW;2022-10-07T09:42:49.410+0200;Testable;2022-10-07T10:07:53.670+0200;Test OK;2022-10-07T10:17:35.566+0200;DELIVERED;2022-10-10T10:23:25.867+0200;DELIVERED INSTALLED;2022-10-10T10:23:28.746+0200;Delivered OK;2022-10-11T10:51:03.533+0200;IN PRODUCTION;2022-10-16T12:07:13.182+0200;Closed;2022-11-15T08:25:51.410+0100;;;;;;;;;;;;;;;;;;;;;;;;;;;;;;;;;;;;;;;;;;;;;;;;;;;;;;;;;;;;;;;;;;;;;;;;;;;;;;;;;;
HV-12079;Primary key LS Estimate ID sequence not triggered during insert;Bug;IN PRODUCTION;Andre van Wingerden;MARE;Pepper;High;Robert Zwetsloot;06.10.2022 16:07;MARE;52-80-39;10.0;26;11;256;0;1;0;0;267;0;0;40;New;2022-10-06T16:10:16.088+0200;Backlog;2022-10-06T16:10:20.843+0200;Backlog;2022-10-17T08:45:54.071+0200;In Progress;2022-10-17T09:16:00.753+0200;IN CODE REVIEW;2022-10-17T11:10:23.843+0200;Testable;2022-10-28T14:19:29.369+0200;Not pretestable;2022-10-28T14:53:59.670+0200;DELIVERED;2022-11-09T17:42:59.785+0100;DELIVERED INSTALLED;2022-11-11T10:36:21.171+0100;Delivered OK;2022-11-21T15:43:18.840+0100;IN PRODUCTION;2022-11-26T11:14:26.629+0100;;;;;;;;;;;;;;;;;;;;;;;;;;;;;;;;;;;;;;;;;;;;;;;;;;;;;;;;;;;;;;;;;;;;;;;;;;;;;;;;;;
HV-12078;Primary key LS Estimate ID should no be set by Interface ;Bug;In Progress;Joerg Johannsson;EDI;eB;Medium;Robert Zwetsloot;06.10.2022 15:39;MARE;;;14;2;0;1366;0;0;0;0;0;0;0;Backlog;2022-10-06T15:53:49.853+0200;In Progress;2022-12-02T13:24:11.908+0100;;;;;;;;;;;;;;;;;;;;;;;;;;;;;;;;;;;;;;;;;;;;;;;;;;;;;;;;;;;;;;;;;;;;;;;;;;;;;;;;;;;;;;;;;;;;;;;;;;;;
HV-12077;Improve speed lasts sensor view;Improvement;Closed;Tasar Sarcan;EDI;Pepper;High;Robert Zwetsloot;06.10.2022 15:05;TMS;;;14;11;0;0;0;0;0;0;0;90;0;Backlog;2022-10-06T15:06:03.087+0200;Backlog;2022-10-06T15:06:19.359+0200;In Progress;2022-10-06T15:28:44.258+0200;IN CODE REVIEW;2022-10-06T15:30:42.542+0200;Testable;2022-10-06T15:41:49.067+0200;Test OK;2022-10-06T15:46:55.122+0200;DELIVERED;2022-10-10T10:23:25.650+0200;DELIVERED INSTALLED;2022-10-10T10:23:28.712+0200;Delivered OK;2022-10-11T10:51:45.507+0200;IN PRODUCTION;2022-10-16T12:07:13.128+0200;Closed;2022-11-15T08:25:51.376+0100;;;;;;;;;;;;;;;;;;;;;;;;;;;;;;;;;;;;;;;;;;;;;;;;;;;;;;;;;;;;;;;;;;;;;;;;;;;;;;;;;;
HV-12076;Change field validation and error message for reference fields;Improvement;IN PRODUCTION;Sreesubha Vijayan;Bookings (Financial);Ingwer;Medium;Oliver Manner-Romberg;06.10.2022 14:25;null;52-80-39;2.0;22;10;0;187;120;0;0;0;27;293;40;Backlog;2022-10-06T14:34:45.423+0200;Backlog;2022-10-06T14:35:02.937+0200;In Progress;2022-10-14T10:19:50.989+0200;Testable;2022-10-19T10:21:01.381+0200;Test OK;2022-10-20T14:04:10.643+0200;Test OK;2022-10-28T13:28:30.705+0200;DELIVERED;2022-11-09T17:42:55.350+0100;DELIVERED INSTALLED;2022-11-11T10:36:20.935+0100;Delivered OK;2022-11-15T11:12:13.246+0100;IN PRODUCTION;2022-11-26T11:14:26.330+0100;;;;;;;;;;;;;;;;;;;;;;;;;;;;;;;;;;;;;;;;;;;;;;;;;;;;;;;;;;;;;;;;;;;;;;;;;;;;;;;;;;;;
HV-12075;Mouse Hover on Multiline Table;User Story;On Hold;Tasar Sarcan;Product;Pepper;Medium;Marcel Hoogenraad;04.10.2022 09:29;TMS;;;18;5;0;167;26;0;672;0;0;0;0;Backlog;2022-10-04T09:39:37.448+0200;Backlog;2022-10-04T09:50:47.724+0200;In Progress;2022-10-11T09:25:36.351+0200;In Clarification;2022-10-12T12:08:54.965+0200;On Hold;2022-11-09T11:25:40.324+0100;;;;;;;;;;;;;;;;;;;;;;;;;;;;;;;;;;;;;;;;;;;;;;;;;;;;;;;;;;;;;;;;;;;;;;;;;;;;;;;;;;;;;;;;;;;;;;
HV-12074;Mouse Hover Descriptions - Intermediate Bulk Containers IBC & Childs;User Story;Testable;Renee Clerx;Equipment;Pepper;Medium;Marcel Hoogenraad;04.10.2022 08:58;TMS;;10.0;29;9;1011;0;196;0;0;312;0;0;0;Backlog;2022-10-06T14:10:21.679+0200;Backlog;2022-10-25T14:42:30.231+0200;In Progress;2022-11-07T08:59:39.950+0100;IN CODE REVIEW;2022-11-08T14:55:25.195+0100;New;2022-11-15T11:53:45.288+0100;Backlog;2022-11-15T11:53:46.776+0100;In Progress;2022-11-15T11:53:49.609+0100;IN CODE REVIEW;2022-11-22T11:30:22.159+0100;Testable;2022-11-28T16:13:18.646+0100;;;;;;;;;;;;;;;;;;;;;;;;;;;;;;;;;;;;;;;;;;;;;;;;;;;;;;;;;;;;;;;;;;;;;;;;;;;;;;;;;;;;;;
HV-12073;Mouse Hover Descriptions - Auxiliary Equipment AUX & Childs;User Story;Testable;Renee Clerx;Equipment;Pepper;Medium;Marcel Hoogenraad;04.10.2022 08:56;TMS;;10.0;29;9;1011;0;171;0;0;506;0;0;0;Backlog;2022-10-06T14:10:21.247+0200;Backlog;2022-10-25T14:42:23.872+0200;In Progress;2022-10-31T10:36:09.256+0100;IN CODE REVIEW;2022-10-31T13:44:42.885+0100;New;2022-11-15T11:53:52.638+0100;Backlog;2022-11-15T11:53:55.194+0100;In Progress;2022-11-15T11:53:59.118+0100;IN CODE REVIEW;2022-11-22T12:11:55.465+0100;Testable;2022-11-28T16:13:25.091+0100;;;;;;;;;;;;;;;;;;;;;;;;;;;;;;;;;;;;;;;;;;;;;;;;;;;;;;;;;;;;;;;;;;;;;;;;;;;;;;;;;;;;;;
HV-12072;Mouse Hover Descriptions - Box Container BLK & Childs;User Story;Testable;Renee Clerx;Equipment;Pepper;Medium;Marcel Hoogenraad;04.10.2022 08:56;TMS;;10.0;31;9;1011;0;174;0;0;576;0;0;0;Backlog;2022-10-06T14:10:21.984+0200;Backlog;2022-10-25T14:42:16.225+0200;In Progress;2022-10-28T10:18:53.606+0200;IN CODE REVIEW;2022-10-28T16:25:01.334+0200;New;2022-11-15T11:54:02.577+0100;Backlog;2022-11-15T11:54:04.505+0100;In Progress;2022-11-15T11:54:08.556+0100;IN CODE REVIEW;2022-11-22T12:12:54.902+0100;Testable;2022-11-28T16:13:31.024+0100;;;;;;;;;;;;;;;;;;;;;;;;;;;;;;;;;;;;;;;;;;;;;;;;;;;;;;;;;;;;;;;;;;;;;;;;;;;;;;;;;;;;;;
HV-12071;Mouse Hover Descriptions - Chassis CCH & Childs;User Story;Testable;Renee Clerx;Equipment;Pepper;Medium;Marcel Hoogenraad;04.10.2022 08:55;TMS;;10.0;31;9;1011;0;209;0;0;584;0;0;0;Backlog;2022-10-06T14:10:21.469+0200;Backlog;2022-10-25T14:42:07.338+0200;In Progress;2022-10-26T13:42:24.617+0200;IN CODE REVIEW;2022-10-28T10:18:28.312+0200;New;2022-11-15T11:54:11.614+0100;Backlog;2022-11-15T11:54:13.293+0100;In Progress;2022-11-15T11:54:17.589+0100;IN CODE REVIEW;2022-11-22T09:15:50.493+0100;Testable;2022-11-28T16:13:42.094+0100;;;;;;;;;;;;;;;;;;;;;;;;;;;;;;;;;;;;;;;;;;;;;;;;;;;;;;;;;;;;;;;;;;;;;;;;;;;;;;;;;;;;;;
HV-12070; Mouse Hover Descriptions - Trailer TRA & Childs;User Story;Testable;Renee Clerx;Equipment;Pepper;Medium;Marcel Hoogenraad;04.10.2022 08:54;TMS;;10.0;28;9;1011;0;284;0;0;675;0;0;0;Backlog;2022-10-06T14:10:21.036+0200;Backlog;2022-10-17T10:10:41.338+0200;In Progress;2022-10-19T16:28:13.921+0200;IN CODE REVIEW;2022-10-28T10:17:45.407+0200;New;2022-11-15T11:54:21.518+0100;Backlog;2022-11-15T11:54:27.661+0100;In Progress;2022-11-15T11:54:31.872+0100;IN CODE REVIEW;2022-11-18T15:03:12.448+0100;Testable;2022-11-28T16:13:49.234+0100;;;;;;;;;;;;;;;;;;;;;;;;;;;;;;;;;;;;;;;;;;;;;;;;;;;;;;;;;;;;;;;;;;;;;;;;;;;;;;;;;;;;;;
HV-12069;Mouse Hover Descriptions - Truck TRU & Childs;User Story;Testable;Renee Clerx;Equipment;Pepper;Medium;Marcel Hoogenraad;04.10.2022 08:54;TMS;;10.0;31;9;1011;0;339;0;0;675;0;0;0;Backlog;2022-10-06T14:10:20.662+0200;Backlog;2022-10-17T10:10:34.628+0200;In Progress;2022-10-17T10:11:40.760+0200;IN CODE REVIEW;2022-10-28T10:17:17.206+0200;New;2022-11-15T11:53:10.649+0100;Backlog;2022-11-15T11:53:12.217+0100;In Progress;2022-11-15T11:53:16.038+0100;IN CODE REVIEW;2022-11-18T15:01:43.873+0100;Testable;2022-11-28T16:13:56.992+0100;;;;;;;;;;;;;;;;;;;;;;;;;;;;;;;;;;;;;;;;;;;;;;;;;;;;;;;;;;;;;;;;;;;;;;;;;;;;;;;;;;;;;;
HV-12068;CLONE - Purchase Orders not created;Bug;Closed;Perry van Steenveldt;CostCalc;Salt;SHOWSTOPPER TST;Berker Ahiska;03.10.2022 15:40;TMS;52-80-36a;1.0;26;12;0;0;5;0;0;0;1;139;0;New;2022-10-03T15:58:27.962+0200;In Clarification;2022-10-03T15:58:59.554+0200;Backlog;2022-10-03T15:59:04.563+0200;In Progress;2022-10-03T16:00:13.887+0200;In Progress;2022-10-04T07:41:29.766+0200;Testable;2022-10-04T13:28:43.779+0200;Test OK;2022-10-04T14:45:27.685+0200;DELIVERED;2022-10-10T10:23:25.943+0200;DELIVERED INSTALLED;2022-10-10T10:23:28.781+0200;Delivered OK;2022-10-11T10:58:50.969+0200;IN PRODUCTION;2022-10-16T12:07:13.226+0200;Closed;2022-11-15T08:25:51.316+0100;;;;;;;;;;;;;;;;;;;;;;;;;;;;;;;;;;;;;;;;;;;;;;;;;;;;;;;;;;;;;;;;;;;;;;;;;;;;;;;;
HV-12067;EDI Estimates Intray Line(Labour Hour)>> Estimate Line (Labour Hour)  ;Improvement;IN PRODUCTION;Andre van Wingerden;MARE;Pepper;Medium;Berker Ahiska;03.10.2022 11:35;MARE;52-80-39;9.0;29;10;333;2;2;0;0;25;235;296;40;Backlog;2022-10-03T12:16:13.649+0200;Backlog;2022-10-17T08:45:39.469+0200;In Progress;2022-10-17T11:13:51.750+0200;IN CODE REVIEW;2022-10-17T13:16:40.148+0200;Testable;2022-10-18T15:06:51.187+0200;Test OK;2022-10-28T10:32:22.507+0200;DELIVERED;2022-11-09T17:42:57.162+0100;DELIVERED INSTALLED;2022-11-11T10:36:21.090+0100;Delivered OK;2022-11-16T10:14:21.341+0100;IN PRODUCTION;2022-11-26T11:14:26.536+0100;;;;;;;;;;;;;;;;;;;;;;;;;;;;;;;;;;;;;;;;;;;;;;;;;;;;;;;;;;;;;;;;;;;;;;;;;;;;;;;;;;;;
HV-12066;EDI Conversion Ext Int Copy/Insert Improvement;Improvement;IN PRODUCTION;Andre van Wingerden;MARE;Pepper;Medium;Berker Ahiska;30.09.2022 11:21;MARE;52-80-39;9.0;20;10;405;101;98;0;0;67;1;292;40;Backlog;2022-09-30T12:17:29.604+0200;Backlog;2022-10-17T08:45:32.221+0200;In Progress;2022-10-21T14:44:52.623+0200;IN CODE REVIEW;2022-10-25T16:53:59.372+0200;Testable;2022-10-28T12:37:03.169+0200;Test OK;2022-10-28T14:24:00.888+0200;DELIVERED;2022-11-09T17:42:57.115+0100;DELIVERED INSTALLED;2022-11-11T10:36:21.056+0100;Delivered OK;2022-11-16T10:01:37.957+0100;IN PRODUCTION;2022-11-26T11:14:26.492+0100;;;;;;;;;;;;;;;;;;;;;;;;;;;;;;;;;;;;;;;;;;;;;;;;;;;;;;;;;;;;;;;;;;;;;;;;;;;;;;;;;;;;
HV-12065;eRENT Copying a contract doesnt fill the field period_base;Bug;IN PRODUCTION;Renee Clerx;eRENT;Pepper;High;Patrick Schwind;29.09.2022 15:52;eRENT;52-80-39;5.0;28;13;0;618;4;0;0;241;0;0;40;Backlog;2022-09-29T15:57:35.406+0200;Backlog;2022-09-29T15:58:39.868+0200;In Clarification;2022-09-29T16:06:20.846+0200;New;2022-09-29T16:06:27.430+0200;Backlog;2022-09-29T16:12:37.846+0200;Backlog;2022-09-29T16:13:00.270+0200;In Progress;2022-10-25T10:26:28.390+0200;IN CODE REVIEW;2022-10-25T14:39:13.009+0200;Not pretestable;2022-11-04T14:54:25.608+0100;DELIVERED;2022-11-09T17:43:00.134+0100;DELIVERED INSTALLED;2022-11-11T10:36:21.459+0100;Delivered OK;2022-11-14T10:01:03.047+0100;IN PRODUCTION;2022-11-26T11:14:26.930+0100;;;;;;;;;;;;;;;;;;;;;;;;;;;;;;;;;;;;;;;;;;;;;;;;;;;;;;;;;;;;;;;;;;;;;;;;;;;;;;
HV-12064;Mouse Hover Descriptions - Tankcontainer TKC & Childs;User Story;Testable;Renee Clerx;Equipment;Pepper;Medium;Marcel Hoogenraad;29.09.2022 10:04;TMS;;10.0;46;9;197;89;219;0;0;939;0;0;0;Backlog;2022-09-29T10:04:47.197+0200;Backlog;2022-10-07T15:54:12.138+0200;In Progress;2022-10-11T09:01:38.375+0200;IN CODE REVIEW;2022-10-17T09:59:56.462+0200;Testable;2022-11-15T11:42:43.563+0100;Test not OK;2022-11-15T11:52:28.657+0100;In Progress;2022-11-15T11:52:31.239+0100;IN CODE REVIEW;2022-11-18T15:03:31.585+0100;Testable;2022-11-28T16:14:10.454+0100;;;;;;;;;;;;;;;;;;;;;;;;;;;;;;;;;;;;;;;;;;;;;;;;;;;;;;;;;;;;;;;;;;;;;;;;;;;;;;;;;;;;;;
HV-12063;Shift template Voyage Duration calculation error ;Bug;Test OK;Bas Dijkgraaf;NDM2VISTA;Salt;High;Mark Pieterse;29.09.2022 09:38;TMS;;5.0;38;10;101;931;0;32;0;5;283;0;0;Backlog;2022-10-03T15:06:18.762+0200;In Clarification;2022-11-11T09:26:32.453+0100;In Clarification;2022-11-16T08:06:52.964+0100;In Progress;2022-11-16T08:07:27.448+0100;PAUSED;2022-11-16T08:07:48.950+0100;In Progress;2022-11-17T16:39:22.190+0100;In Progress;2022-11-23T09:43:59.108+0100;IN CODE REVIEW;2022-11-23T09:45:09.643+0100;Testable;2022-11-23T15:24:31.239+0100;Test OK;2022-12-05T10:54:49.518+0100;;;;;;;;;;;;;;;;;;;;;;;;;;;;;;;;;;;;;;;;;;;;;;;;;;;;;;;;;;;;;;;;;;;;;;;;;;;;;;;;;;;;
HV-12062;Description displayed on the screens (Equipment) Part 2;Epic;In Progress;Marcel Hoogenraad;Equipment;Pepper;Medium;Stefanie Mueller;29.09.2022 09:17;TMS;;15.0;35;9;0;286;0;0;0;0;0;0;0;New;2022-09-29T09:17:15.567+0200;In Analysis;2022-09-29T09:19:30.515+0200;In Review;2022-09-29T09:19:40.528+0200;Reviewed;2022-09-29T09:19:55.247+0200;Approved;2022-09-29T10:04:29.945+0200;DEV IN REVIEW;2022-09-29T10:04:42.099+0200;DEV REVIEWED OK;2022-09-29T10:04:44.660+0200;Backlog;2022-09-29T10:04:46.989+0200;In Progress;2022-10-11T09:01:38.389+0200;;;;;;;;;;;;;;;;;;;;;;;;;;;;;;;;;;;;;;;;;;;;;;;;;;;;;;;;;;;;;;;;;;;;;;;;;;;;;;;;;;;;;;
HV-12061;No Order Confirmation Wacker due to missing Load activity in shipment;Bug;Closed;Joerg Johannsson;ORD Interface;eB;High;Mark Pieterse;29.09.2022 09:15;TMS;;;16;3;2;863;0;0;0;0;0;0;0;Backlog;2022-09-29T11:54:41.560+0200;On Hold;2022-11-04T10:49:41.863+0100;Closed;2022-11-04T10:50:16.285+0100;;;;;;;;;;;;;;;;;;;;;;;;;;;;;;;;;;;;;;;;;;;;;;;;;;;;;;;;;;;;;;;;;;;;;;;;;;;;;;;;;;;;;;;;;;;;;;;;;;
HV-12060;IBA - Exception error when exporting booking to Coda;Bug;In Clarification;Oliver Manner-Romberg;Bookings (Financial);Ingwer;High;Oliver Manner-Romberg;29.09.2022 09:04;null;;3.0;23;6;0;32;117;0;0;0;0;0;0;Backlog;2022-09-29T09:19:38.264+0200;Backlog;2022-09-29T09:19:51.460+0200;Backlog;2022-09-29T09:20:13.836+0200;In Progress;2022-09-30T17:57:38.299+0200;In Progress;2022-10-05T10:47:25.451+0200;In Clarification;2022-10-10T08:23:39.974+0200;;;;;;;;;;;;;;;;;;;;;;;;;;;;;;;;;;;;;;;;;;;;;;;;;;;;;;;;;;;;;;;;;;;;;;;;;;;;;;;;;;;;;;;;;;;;
HV-12050;Delivery Release 52-80-36;Build;Closed;Thomas Deter;null;null;null;Thomas Deter;28.09.2022 16:07;null;52-80-36;;59;10;0;0;1;0;0;0;0;0;15;In Progress;2022-09-28T16:07:56.352+0200;DELIVERED;2022-09-28T17:40:40.494+0200;DELIVERED INSTALLED;2022-09-29T08:58:32.847+0200;IN PRODUCTION;2022-10-16T12:06:52.882+0200;In Clarification;2022-11-15T08:04:58.065+0100;In Progress;2022-11-15T08:05:00.456+0100;DELIVERED;2022-11-15T08:05:02.966+0100;DELIVERED INSTALLED;2022-11-15T08:05:06.980+0100;IN PRODUCTION;2022-11-15T08:05:40.157+0100;Closed;2022-11-15T08:25:23.704+0100;;;;;;;;;;;;;;;;;;;;;;;;;;;;;;;;;;;;;;;;;;;;;;;;;;;;;;;;;;;;;;;;;;;;;;;;;;;;;;;;;;;;
HV-12049;Fixing the Unit Test Failures - ut_tms_costcalc_pck;Unit Test;In Progress;Lennart Schultz;Unit Test;Salt;null;Bindhu Kannusamy;28.09.2022 15:56;null;;15.0;12;5;0;0;72;0;0;0;0;0;0;In Progress;2022-10-04T15:29:55.908+0200;IN CODE REVIEW;2022-10-07T16:07:32.340+0200;Closed;2022-10-07T16:57:19.342+0200;In Clarification;2022-12-01T11:24:14.082+0100;In Progress;2022-12-01T11:24:26.439+0100;;;;;;;;;;;;;;;;;;;;;;;;;;;;;;;;;;;;;;;;;;;;;;;;;;;;;;;;;;;;;;;;;;;;;;;;;;;;;;;;;;;;;;;;;;;;;;
HV-12048;Fixing the Unit Test Failures - ut_tms_asc_checks_pck;Unit Test;Closed;Bindhu Kannusamy;Unit Test;Salt;null;Bindhu Kannusamy;28.09.2022 15:46;null;;15.0;7;3;0;0;167;0;0;0;0;0;0;In Progress;2022-09-30T16:07:11.260+0200;IN CODE REVIEW;2022-10-07T16:04:53.647+0200;Closed;2022-10-07T16:55:41.423+0200;;;;;;;;;;;;;;;;;;;;;;;;;;;;;;;;;;;;;;;;;;;;;;;;;;;;;;;;;;;;;;;;;;;;;;;;;;;;;;;;;;;;;;;;;;;;;;;;;;
HV-12047;Fixing the Remaining Unit Test Failures - ut_tms_action_dml_pck;Unit Test;Backlog;Bindhu Kannusamy;Unit Test;Salt;null;Bindhu Kannusamy;28.09.2022 13:00;null;;;7;5;22;0;0;0;0;0;0;0;0;On Hold;2022-09-28T14:31:22.957+0200;In Clarification;2022-09-29T11:58:13.850+0200;In Progress;2022-09-29T11:58:18.160+0200;On Hold;2022-09-29T11:58:51.063+0200;Backlog;2022-09-29T11:58:59.618+0200;;;;;;;;;;;;;;;;;;;;;;;;;;;;;;;;;;;;;;;;;;;;;;;;;;;;;;;;;;;;;;;;;;;;;;;;;;;;;;;;;;;;;;;;;;;;;;
HV-12046;IBA - Barcode reference of original subcontractor credit note is shown in wrong format;Bug;Closed;Perry van Steenveldt;Crystal Report;Ingwer;High;Oliver Manner-Romberg;28.09.2022 12:49;TMS;52-80-37;;25;11;20;0;0;0;0;0;4;317;17;Backlog;2022-09-28T14:15:04.551+0200;Backlog;2022-09-28T14:15:22.296+0200;Backlog;2022-09-29T09:49:32.611+0200;In Progress;2022-09-29T09:50:30.085+0200;Testable;2022-09-29T10:07:16.074+0200;Test OK;2022-09-29T14:31:49.795+0200;DELIVERED;2022-10-12T19:37:05.389+0200;DELIVERED INSTALLED;2022-10-13T13:09:19.902+0200;Delivered OK;2022-10-18T10:39:39.704+0200;IN PRODUCTION;2022-10-29T11:42:40.876+0200;Closed;2022-11-15T08:27:14.159+0100;;;;;;;;;;;;;;;;;;;;;;;;;;;;;;;;;;;;;;;;;;;;;;;;;;;;;;;;;;;;;;;;;;;;;;;;;;;;;;;;;;
HV-12045;Using special email characters in Vista for customers;Improvement;Closed;Perry van Steenveldt;Email;Salt;High;Mark Pieterse;27.09.2022 11:53;TMS;52-80-37;;30;13;4;0;22;0;0;0;0;339;17;Backlog;2022-09-27T14:04:40.153+0200;Backlog;2022-09-27T16:44:54.956+0200;In Progress;2022-09-27T16:45:03.256+0200;Testable;2022-09-28T14:45:40.621+0200;Test not OK;2022-09-28T15:37:18.436+0200;In Progress;2022-09-28T15:40:37.578+0200;Testable;2022-09-28T16:17:31.056+0200;Test OK;2022-09-28T16:26:10.091+0200;DELIVERED;2022-10-12T19:37:03.911+0200;DELIVERED INSTALLED;2022-10-13T13:09:19.444+0200;Delivered OK;2022-10-19T09:56:19.262+0200;IN PRODUCTION;2022-10-29T11:42:40.382+0200;Closed;2022-11-15T08:27:14.489+0100;;;;;;;;;;;;;;;;;;;;;;;;;;;;;;;;;;;;;;;;;;;;;;;;;;;;;;;;;;;;;;;;;;;;;;;;;;;;;;
HV-12044;Estimate Interface Test Results 26/09/2022;User Story;Closed;Andre van Wingerden;MARE;Pepper;Medium;Marcel Hoogenraad;27.09.2022 11:22;MARE;52-80-36;;19;11;0;0;0;0;0;0;3;25;15;Backlog;2022-09-27T11:22:16.528+0200;Backlog;2022-09-27T11:22:42.087+0200;In Progress;2022-09-27T11:26:40.795+0200;IN CODE REVIEW;2022-09-27T11:29:26.967+0200;Testable;2022-09-27T11:50:27.963+0200;Test OK;2022-09-27T15:44:55.077+0200;DELIVERED;2022-09-28T17:40:41.404+0200;DELIVERED INSTALLED;2022-09-29T08:58:33.046+0200;Delivered OK;2022-10-03T10:08:18.053+0200;IN PRODUCTION;2022-10-16T12:06:53.021+0200;Closed;2022-11-15T08:25:23.891+0100;;;;;;;;;;;;;;;;;;;;;;;;;;;;;;;;;;;;;;;;;;;;;;;;;;;;;;;;;;;;;;;;;;;;;;;;;;;;;;;;;;
HV-12043;PACC Matrix Agreement validity, Update till < Valid from (should no be possible);Bug;Closed;Bas Dijkgraaf;PACC Rail/Vessel;Salt;High;Sebastiaan Beuker;27.09.2022 10:28;TMS;52-80-38;;22;10;221;0;0;0;0;0;0;476;18;Backlog;2022-09-27T11:34:39.995+0200;Backlog;2022-10-06T15:36:26.524+0200;In Progress;2022-10-06T15:45:44.177+0200;Testable;2022-10-06T16:11:41.918+0200;Test OK;2022-10-06T16:31:01.673+0200;DELIVERED;2022-10-26T13:16:09.122+0200;DELIVERED INSTALLED;2022-10-27T07:53:33.130+0200;Delivered OK;2022-11-04T10:27:39.209+0100;IN PRODUCTION;2022-11-14T20:20:55.416+0100;Closed;2022-11-15T08:37:10.937+0100;;;;;;;;;;;;;;;;;;;;;;;;;;;;;;;;;;;;;;;;;;;;;;;;;;;;;;;;;;;;;;;;;;;;;;;;;;;;;;;;;;;;
HV-12042;IBA - Headlines are not shown in crystal report of outgoing invoice;Bug;Closed;Perry van Steenveldt;Crystal Report;Ingwer;Medium;Oliver Manner-Romberg;27.09.2022 09:20;eRENT;52-80-36;;30;15;0;0;0;0;0;0;2;28;15;Backlog;2022-09-27T09:55:44.428+0200;Backlog;2022-09-27T09:56:13.009+0200;Backlog;2022-09-27T09:56:25.889+0200;In Progress;2022-09-27T10:26:10.646+0200;In Progress;2022-09-27T10:26:20.000+0200;Testable;2022-09-27T10:41:31.381+0200;Test not OK;2022-09-27T12:05:26.051+0200;In Progress;2022-09-27T12:19:05.695+0200;Testable;2022-09-27T12:19:11.849+0200;Test OK;2022-09-27T13:29:35.945+0200;DELIVERED;2022-09-28T17:40:42.100+0200;DELIVERED INSTALLED;2022-09-29T08:58:34.309+0200;Delivered OK;2022-10-04T08:52:01.265+0200;IN PRODUCTION;2022-10-16T12:06:54.548+0200;Closed;2022-11-15T08:25:24.411+0100;;;;;;;;;;;;;;;;;;;;;;;;;;;;;;;;;;;;;;;;;;;;;;;;;;;;;;;;;;;;;;;;;;;;;;;;;;
HV-12041;Estimate Interface Test Results 26/09/2022;Epic;Closed;Marcel Hoogenraad;MARE;Pepper;Medium;Carolin Schmitz;26.09.2022 17:21;MARE;52-80-36;;24;15;18;0;4;0;0;0;0;25;15;New;2022-09-26T17:21:00.971+0200;In Analysis;2022-09-27T09:02:13.647+0200;In Review;2022-09-27T11:12:51.079+0200;Reviewed;2022-09-27T11:13:13.887+0200;Approved;2022-09-27T11:13:18.378+0200;DEV IN REVIEW;2022-09-27T11:22:12.661+0200;DEV REVIEWED OK;2022-09-27T11:22:14.499+0200;Backlog;2022-09-27T11:22:16.203+0200;In Progress;2022-09-27T11:26:40.805+0200;Test OK;2022-09-27T15:44:55.089+0200;DELIVERED;2022-09-28T17:40:41.415+0200;DELIVERED INSTALLED;2022-09-29T08:58:33.055+0200;Delivered OK;2022-10-03T10:08:18.141+0200;IN PRODUCTION;2022-10-16T12:06:53.034+0200;Closed;2022-11-15T08:25:24.868+0100;;;;;;;;;;;;;;;;;;;;;;;;;;;;;;;;;;;;;;;;;;;;;;;;;;;;;;;;;;;;;;;;;;;;;;;;;;
HV-12040;Copy Repair Library related Master Data PROD-2-DELY/DEPL/DEVL;Improvement;Closed;Berker Ahiska;MARE;Pepper;Medium;Berker Ahiska;23.09.2022 14:44;MARE;;;4;1;0;0;0;0;0;0;0;0;0;Closed;2022-09-23T15:17:54.977+0200;;;;;;;;;;;;;;;;;;;;;;;;;;;;;;;;;;;;;;;;;;;;;;;;;;;;;;;;;;;;;;;;;;;;;;;;;;;;;;;;;;;;;;;;;;;;;;;;;;;;;;
HV-12038;IBA - Partly credit/validation of subcontractor credit note doesn't work;Bug;Closed;Perry van Steenveldt;IBA;Ingwer;High;Oliver Manner-Romberg;23.09.2022 14:13;TMS;52-80-36;;32;13;1;69;0;22;0;0;2;27;15;Backlog;2022-09-23T15:27:50.348+0200;Backlog;2022-09-23T15:28:11.379+0200;In Progress;2022-09-26T13:10:29.066+0200;PAUSED;2022-09-26T13:11:03.929+0200;PAUSED;2022-09-26T13:11:13.858+0200;In Progress;2022-09-27T12:05:45.028+0200;Testable;2022-09-27T12:06:58.275+0200;Test OK;2022-09-27T14:37:18.080+0200;DELIVERED;2022-09-28T17:40:41.940+0200;DELIVERED INSTALLED;2022-09-29T08:58:34.102+0200;Delivered OK;2022-09-29T13:54:13.338+0200;IN PRODUCTION;2022-10-16T12:06:54.042+0200;Closed;2022-11-15T08:25:24.236+0100;;;;;;;;;;;;;;;;;;;;;;;;;;;;;;;;;;;;;;;;;;;;;;;;;;;;;;;;;;;;;;;;;;;;;;;;;;;;;;
HV-12036;Equipment Renumbering - Renumbering Dates & Child Tab View;Improvement;IN PRODUCTION;Viktor den Boer;Equipment;Pepper;Medium;Berker Ahiska;22.09.2022 10:18;TMS;52-80-39;5.0;39;10;460;0;162;0;0;52;194;290;40;Backlog;2022-09-22T11:01:03.267+0200;Backlog;2022-10-11T14:48:46.765+0200;In Progress;2022-10-11T14:49:04.004+0200;IN CODE REVIEW;2022-10-18T09:34:59.759+0200;Testable;2022-10-20T13:48:02.687+0200;Test OK;2022-10-28T15:51:08.253+0200;DELIVERED;2022-11-09T17:42:56.999+0100;DELIVERED INSTALLED;2022-11-11T10:36:20.980+0100;Delivered OK;2022-11-16T09:54:25.104+0100;IN PRODUCTION;2022-11-26T11:14:26.386+0100;;;;;;;;;;;;;;;;;;;;;;;;;;;;;;;;;;;;;;;;;;;;;;;;;;;;;;;;;;;;;;;;;;;;;;;;;;;;;;;;;;;;
HV-12035;IBA - Printing Batch Job FAILED but BatchScheduler says SUCCEEDED;Bug;In Progress;Sreesubha Vijayan;Batch Server / APEX Scheduler;Ingwer;Medium;Oliver Manner-Romberg;21.09.2022 15:58;null;;10.0;37;8;23;644;298;419;0;0;0;0;0;Backlog;2022-09-22T15:12:45.022+0200;In Progress;2022-10-19T11:44:32.567+0200;PAUSED;2022-10-21T14:34:37.030+0200;In Progress;2022-10-26T10:59:27.882+0200;PAUSED;2022-10-27T16:33:50.533+0200;In Progress;2022-11-07T11:59:07.730+0100;PAUSED;2022-11-16T15:11:20.172+0100;In Progress;2022-11-18T10:34:19.278+0100;;;;;;;;;;;;;;;;;;;;;;;;;;;;;;;;;;;;;;;;;;;;;;;;;;;;;;;;;;;;;;;;;;;;;;;;;;;;;;;;;;;;;;;;
HV-12034;Delivery Release 52-80-35a;Build;Closed;Thomas Deter;null;Muskat;null;Thomas Deter;21.09.2022 15:58;null;52-80-35a;;22;5;0;0;21;0;0;0;0;0;3;In Progress;2022-09-21T15:59:07.917+0200;DELIVERED;2022-09-22T13:13:30.848+0200;DELIVERED INSTALLED;2022-09-22T16:20:30.049+0200;IN PRODUCTION;2022-09-23T09:38:36.843+0200;Closed;2022-09-26T15:39:51.102+0200;;;;;;;;;;;;;;;;;;;;;;;;;;;;;;;;;;;;;;;;;;;;;;;;;;;;;;;;;;;;;;;;;;;;;;;;;;;;;;;;;;;;;;;;;;;;;;
HV-12033;Purchase Orders not created;Bug;Closed;Bas Dijkgraaf;CostCalc;Salt;Immediate;Berker Ahiska;21.09.2022 15:23;TMS;52-80-35a;;25;10;0;0;0;0;0;0;0;20;3;Backlog;2022-09-21T15:29:05.178+0200;Backlog;2022-09-21T15:30:11.315+0200;In Progress;2022-09-21T15:33:12.181+0200;Testable;2022-09-21T15:54:41.123+0200;Test OK;2022-09-21T16:38:29.511+0200;DELIVERED;2022-09-22T13:13:30.865+0200;DELIVERED INSTALLED;2022-09-22T16:20:30.065+0200;Delivered OK;2022-09-22T16:22:51.067+0200;IN PRODUCTION;2022-09-23T09:38:36.868+0200;Closed;2022-09-26T15:40:09.736+0200;;;;;;;;;;;;;;;;;;;;;;;;;;;;;;;;;;;;;;;;;;;;;;;;;;;;;;;;;;;;;;;;;;;;;;;;;;;;;;;;;;;;
HV-12032;Default childtab security cannot be changed sometimes due to wrong child page id;Bug;Closed;Andre van Wingerden;Security;Chili;Medium;Dennis Schouten;21.09.2022 13:27;null;52-80-38;;29;10;0;386;0;0;115;0;26;310;18;Backlog;2022-09-21T13:35:05.510+0200;In Clarification;2022-10-07T16:08:04.945+0200;In Progress;2022-10-12T12:07:43.266+0200;Testable;2022-10-12T12:27:20.201+0200;Test OK;2022-10-13T15:07:32.564+0200;DELIVERED;2022-10-26T13:16:09.074+0200;DELIVERED INSTALLED;2022-10-27T07:53:33.076+0200;Delivered OK;2022-11-01T09:06:15.254+0100;IN PRODUCTION;2022-11-14T20:20:55.361+0100;Closed;2022-11-15T08:37:10.882+0100;;;;;;;;;;;;;;;;;;;;;;;;;;;;;;;;;;;;;;;;;;;;;;;;;;;;;;;;;;;;;;;;;;;;;;;;;;;;;;;;;;;;
HV-12031;RENT: IBC Overview doesn't open extra window for order/oet;Bug;Backlog;Kim Fabian Tiedemann;Multilog Rental;Chili;Medium;Rainer Kohnert;21.09.2022 12:06;RENT;;;6;1;0;0;0;0;0;0;0;0;0;Backlog;2022-09-21T12:07:13.488+0200;;;;;;;;;;;;;;;;;;;;;;;;;;;;;;;;;;;;;;;;;;;;;;;;;;;;;;;;;;;;;;;;;;;;;;;;;;;;;;;;;;;;;;;;;;;;;;;;;;;;;;
HV-12030;ACEP and Certificate Send To conversion into LOV and Description pop-up;Improvement;Backlog;Viktor den Boer;Equipment;Pepper;Medium;Berker Ahiska;21.09.2022 10:48;TMS;;5.0;35;2;1509;0;0;0;0;0;0;0;0;Backlog;2022-09-22T13:42:44.689+0200;Backlog;2022-11-23T07:40:43.514+0100;;;;;;;;;;;;;;;;;;;;;;;;;;;;;;;;;;;;;;;;;;;;;;;;;;;;;;;;;;;;;;;;;;;;;;;;;;;;;;;;;;;;;;;;;;;;;;;;;;;;
HV-12029;RENT: IBC Overview not refreshed after delete of OET;Bug;Backlog;Kim Fabian Tiedemann;Multilog Rental;Chili;Medium;Rainer Kohnert;21.09.2022 09:37;RENT;;;3;1;0;0;0;0;0;0;0;0;0;Backlog;2022-09-21T09:38:24.395+0200;;;;;;;;;;;;;;;;;;;;;;;;;;;;;;;;;;;;;;;;;;;;;;;;;;;;;;;;;;;;;;;;;;;;;;;;;;;;;;;;;;;;;;;;;;;;;;;;;;;;;;
HV-12028;Delivery Release 52-80-34c;Build;Closed;Thomas Deter;null;Muskat;null;Thomas Deter;20.09.2022 15:08;null;;;22;8;25;0;2;0;0;0;0;0;18;In Progress;2022-09-20T15:09:23.189+0200;In Clarification;2022-09-20T15:09:25.999+0200;In Progress;2022-09-20T15:09:30.147+0200;DELIVERED;2022-09-20T17:33:07.270+0200;DELIVERED INSTALLED;2022-09-21T12:30:47.715+0200;On Hold;2022-09-21T16:26:03.087+0200;Backlog;2022-09-21T16:26:45.002+0200;Closed;2022-09-21T16:27:22.987+0200;;;;;;;;;;;;;;;;;;;;;;;;;;;;;;;;;;;;;;;;;;;;;;;;;;;;;;;;;;;;;;;;;;;;;;;;;;;;;;;;;;;;;;;;
HV-12027;Eq Dates Status is NULL when inserted via AS400 Interface ;Improvement;On Hold;Andre van Wingerden;Equipment;Pepper;Medium;Berker Ahiska;20.09.2022 10:20;TMS;;;23;5;2;44;0;0;0;23;0;0;0;New;2022-09-20T13:20:13.454+0200;Backlog;2022-09-20T13:20:25.458+0200;In Progress;2022-09-22T10:11:56.742+0200;IN CODE REVIEW;2022-09-22T10:31:45.377+0200;On Hold;2022-09-23T10:27:52.316+0200;;;;;;;;;;;;;;;;;;;;;;;;;;;;;;;;;;;;;;;;;;;;;;;;;;;;;;;;;;;;;;;;;;;;;;;;;;;;;;;;;;;;;;;;;;;;;;
